{"eval_id": 257, "standalone_query": "유전자에서 여러가지 단백질이 만들어지는 원인", "topk": ["c8bd9b15-8ce0-4307-9f49-0f205217178f", "a74357de-1a40-48c4-9811-1edbdff42f0b", "51dd3dc3-8bee-46ca-96af-de0af97900df"], "references": [{"score": 0.17810369, "content": "동일한 유전자에서 여러 다른 단백질이 생성될 수 있는 이유는 많은 유전자의 기본 전사물이 다양한 방법으로 이어맞출 수 있기 때문입니다. 이러한 과정을 선택적 RNA 이어맞추기라고 합니다. 선택적 RNA 이어맞추기는 여러 mRNA를 생성하는 과정으로, 이를 통해 다양한 단백질이 생성될 수 있습니다. 이는 유전자의 정보를 효율적으로 활용하여 여러 다른 기능을 수행하는 단백질을 만들어낼 수 있는 메커니즘입니다. 선택적 RNA 이어맞추기는 전사 중에 발생하는 다양한 조절 단계에서 일어나며, 이를 통해 특정 조건이나 시기에 맞춰서 특정 단백질을 생성할 수 있습니다. 이러한 유연성은 생물체가 다양한 환경 조건에 적응하고 생존할 수 있도록 도와줍니다. 따라서 동일한 유전자에서 여러 다른 단백질이 생성될 수 있는 것입니다."}, {"score": 0.13586661, "content": "인간의 단백질 코딩 유전자는 현재 약 19,000-20,000개로 추정되고 있습니다. 이 추정치는 시간이 지남에 따라 줄어들 수 있습니다. 단백질 코딩 유전자는 생물체의 유전 정보를 담고 있으며, 단백질의 합성에 관여합니다. 이러한 유전자는 DNA 염기서열을 통해 인간의 유전체에 존재하며, 각각의 유전자는 특정한 단백질을 생성합니다. 인간의 단백질 코딩 유전자는 생명체의 다양한 기능과 특성에 영향을 미치는 중요한 역할을 합니다. 그러나 시간이 지남에 따라 유전자의 수는 변동할 수 있으며, 이는 진화 및 유전적 다양성의 일부로 볼 수 있습니다."}, {"score": 0.13335206, "content": "엑손은 단백질 코딩 유전자의 일부로, 비코딩 디엔에이로 구성되어 있습니다. 엑손은 유전자의 정보를 전달하고 단백질 합성에 관여합니다. 비코딩 디엔에이는 유전자의 조절에 중요한 역할을 합니다. 엑손은 유전자의 전사과정에서 전사체로 복사되어 mRNA로 변환됩니다. 이후 mRNA는 리보솜에서 번역되어 단백질로 합성됩니다. 엑손은 유전자의 다양한 기능을 담당하며, 유전자의 다른 부분과 조합되어 다양한 단백질을 생성합니다. 따라서 엑손은 생물체의 발달과 기능에 중요한 역할을 합니다."}]}
{"eval_id": 58, "standalone_query": "질산을 통한 염화물 침전시 염소의 비율을 구하는 방법", "topk": ["25bf6c36-116f-42c9-9d1c-c179e6292a34", "1513372c-c97d-4594-ba58-65a05c6330dc", "4dce7b7e-7c70-4105-a928-9f8d02ebbc04"], "references": [{"score": 0.1645045, "content": "2.35g의 샘플을 물에 용해시키고 질산(Ag+ + Cl- → AgCl)을 첨가하여 염화물 이온을 침전시켰다. 0.435g의 침전물이 형성되었을 때, 샘플의 염소 비율을 계산하려면 다음 공식을 사용할 수 있습니다.\n염소 백분율 = (염소 질량 / 시료 질량) x 100\n침전물의 질량이 0.435g이라고 가정하면 침전물에 포함된 염소의 질량을 구해야 합니다. 침전물은 AgCl이므로 Ag와 Cl의 몰비는 1:1임을 알 수 있습니다. AgCl의 몰 질량은 143.32 g/mol이고, Ag의 몰 질량은 107.87 g/mol이고 Cl의 몰 질량은 35.45 g/mol입니다.\n몰비를 사용하여 침전물에 포함된 염소의 질량을 계산할 수 있습니다.\n염소의 질량 = (침전물의 질량 / AgCl의 몰 질량) x Cl의 몰 질량\n= (0.435g / 143.32g/mol) x 35.45g/mol\n= 0.107g\n이제 샘플의 염소 비율을 계산할 수 있습니다.\n염소 비율 = (0.107g / 2.35g) x 100\n= 4.60%\n따라서 샘플의 염소 비율은 4.60%입니다."}, {"score": 0.10768944, "content": "염화티오닐(SOCl2)은 분자 구조가 삼방 피라미드 형태를 가지고 있습니다. 이 분자는 황과 염소, 그리고 두 개의 염소 원자로 구성되어 있습니다. 황 원자는 중심에 위치하고, 염소 원자들은 황 원자 주위에 배치되어 있습니다. 이러한 분자 구조는 황과 염소 원자들 사이의 결합 각도가 107도 정도로 형성되어 있습니다. 이러한 분자 구조는 분자의 안정성과 화학적 특성에 영향을 미칩니다. 염화티오닐은 유기 화합물의 합성과 반응에서 중요한 역할을 하는 화합물로 알려져 있습니다."}, {"score": 0.10664122, "content": "알루미늄 염화물(AlCl3)은 이온 강도가 가장 높은 용액 중 하나입니다. 이 용액은 완전한 해리를 가정할 때, 0.050 M 농도로 존재합니다. 알루미늄 염화물은 알루미늄(Al)과 염소(Cl) 이온으로 이루어져 있으며, 이온들은 용액 속에서 완전히 해리되어 이온 강도를 가지게 됩니다. 따라서, 0.050 M 농도의 알루미늄 염화물 용액은 가장 높은 이온 강도를 가지게 됩니다."}]}
{"eval_id": 283, "standalone_query": "", "topk": [], "references": []}
{"eval_id": 32, "standalone_query": "", "topk": [], "references": []}
{"eval_id": 94, "standalone_query": "", "topk": [], "references": []}
{"eval_id": 15, "standalone_query": "과학 연구자가 가져야 할 태도와 자세", "topk": ["166f5ff3-8d29-4a35-8397-1d14a7c886b5", "3f93b057-0edb-401e-8988-4fbb801df9b4", "0c8a208e-6228-435a-9544-4b95af91b6f7"], "references": [{"score": 0.08808757, "content": "과학적 발견에 대해 의심하는 태도는 과학계에서 매우 중요합니다. 왜냐하면 모든 과학적 발견은 받아들여지기 전에 비판적으로 검토되어야 하기 때문입니다. 과학은 사실과 증거에 기반한 학문이기 때문에, 새로운 발견이 제시되었을 때 우리는 그것을 의심하고 검증해야 합니다. 이를 통해 우리는 잘못된 정보나 잘못된 결론을 피할 수 있으며, 정확하고 신뢰할 수 있는 지식을 얻을 수 있습니다. 또한, 의심하는 태도는 과학적 방법론의 핵심 원칙 중 하나인 '검증 가능성'을 강조합니다. 과학적 발견은 다른 연구자들에 의해 독립적으로 재현되고 검증되어야 합니다. 이를 통해 우리는 과학적 지식의 신뢰성을 높일 수 있습니다. 따라서, 조앤의 과학 선생님의 충고는 매우 중요하며, 우리는 새로운 과학적 발견에 대해 항상 의심하는 태도를 가져야 합니다."}, {"score": 0.07624764, "content": "과학자들은 질문에 답하기 위해 연구를 실시합니다. 이를 위해 다양한 실험과 조사를 진행하며, 관련 증거를 수집해야 합니다. 이러한 과정을 통해 과학자들은 타당한 결론을 내릴 수 있게 됩니다. 연구 결과를 토대로 과학자들은 사실에 기반한 설명과 이론을 제시합니다. 이러한 과학적 방법을 통해 우리는 세상의 다양한 현상과 문제에 대한 이해를 높일 수 있습니다. 과학자들은 항상 신중하게 연구를 진행하며, 타당한 결론을 내리기 위해 노력합니다."}, {"score": 0.0726936, "content": "과학자가 실험실에서 발견을 했다고 주장합니다. 이 발견이 유효하다는 것을 증명하기 위해 과학자는 실험을 신중하게 계획하고 수행해야 합니다. 실험 과정에서는 정확한 기록을 남기고 데이터의 일관성을 보여주어야 합니다. 이를 위해 과학자는 실험 결과를 정확하게 기록하고 실험 조건을 상세히 기술해야 합니다. 그리고 실험 결과를 통계적으로 분석하여 유의미한 결과를 도출해야 합니다. 이를 위해 과학자는 적절한 통계 분석 방법을 사용하고 결과를 표현하는 방법에 대해 신중하게 고려해야 합니다. 또 다른 단계로는 과학자는 실험 결과를 다른 연구자들과 공유해야 합니다. 이를 위해 과학자는 발표나 논문을 통해 자신의 연구 내용을 상세히 설명하고 다른 연구자들의 의견을 수렴해야 합니다. 마지막 단계로는 과학자는 실험 결과를 반복 실험을 통해 검증해야 합니다. 이를 통해 과학자는 자신의 발견이 유효하다는 것을 더욱 강력하게 증명할 수 있습니다. 따라서, 과학자가 실험실에서 발견을 했다고 주장하기 위해서 가장 중요한 단계로 증면하는 방법으로는 데이터의 일관성을 보여주는 정확한 기록이 필요합니다."}]}
{"eval_id": 4, "standalone_query": "나이가 들수록 시간이 빨리 간다는 현상 원인", "topk": ["aa674ad5-ae70-4223-8685-e717a27dc1b3", "0c031e2f-dfb5-4b27-b96d-e9c2517193a9", "b19204fc-d1c9-4ac2-b3b5-589e501bd5ed"], "references": [{"score": 0.09255347, "content": "노인들이 시간이 더 빠르게 흐르는 것처럼 느껴지는 이유는 다양한 이유가 있을 수 있지만, 그 중 하나는 새로운 경험을 덜 가지기 때문이다. 노인들은 젊은 시절에 비해 많은 경험을 쌓았고, 일상적인 일들이 반복되는 경우가 많아서 시간이 빨리 흐른다고 느껴질 수 있다. 또한, 노인들은 체력이 저하되고 건강상의 이유로 활동량이 줄어들기 때문에, 일상 생활에서의 활동이 제한되고 일정한 패턴으로 반복되는 경우가 많다. 이로 인해 일상 생활이 단조로워지고 시간이 빨리 흐른다는 느낌을 받을 수 있다. 노인들은 또한 노화로 인해 인지 능력이 저하되는 경우가 많아서, 시간의 경과를 정확하게 인지하기 어려울 수 있다. 이러한 이유들로 인해 노인들은 시간이 더 빠르게 흐르는 것처럼 느껴질 수 있다."}, {"score": 0.08003559, "content": "스미스는 자신에 대한 종단적 연구를 진행한 여성입니다. 그녀는 나이가 들면서 검색이 곤란한 것을 발견했습니다. 스미스는 많은 시간과 노력을 투자하여 자신의 삶과 경험에 대해 깊이 있는 연구를 진행했습니다. 그 결과, 그녀는 나이가 들면서 검색이 어려워지는 현상을 발견했습니다. 이는 많은 사람들에게 영감을 주었으며, 스미스의 연구는 많은 사람들에게 도움이 되었습니다. 스미스의 연구는 미래의 연구에도 큰 영향을 미칠 것으로 기대됩니다."}, {"score": 0.079677, "content": "나이가 들수록 발생하는 손실이 아닌 이득의 예는 관점입니다. 나이가 들면서 우리는 더 많은 경험과 지식을 얻게 되고, 이를 통해 성취감과 자신감을 얻을 수 있습니다. 또한, 나이가 들면서 우리는 더 많은 사람들과의 관계를 형성하고 소통할 수 있습니다. 이는 우리에게 새로운 아이디어와 관점을 제공하며, 창의적인 문제 해결과 협력을 촉진합니다. 또한, 나이가 들면서 우리는 더욱 깊은 통찰력과 지혜를 얻을 수 있습니다. 이는 우리가 삶의 복잡한 문제를 해결하고 더 나은 결정을 내릴 수 있게 도와줍니다. 따라서, 나이가 들수록 발생하는 손실이 아닌 이득의 예는 관점입니다."}]}
{"eval_id": 300, "standalone_query": "퇴직한 사람들에게 사회 보장의 의미", "topk": ["41ce1303-0091-4414-b26d-18f66101a99f", "bb33e3f3-d470-4276-80ca-168d4102b932", "f039bf4d-382f-4fac-916d-0bfa901144d3"], "references": [{"score": 0.09393446, "content": "사회 보장은 대부분의 은퇴자들이 가지고 있는 세 다리 의자 중 하나입니다. 사회 보장은 은퇴자들에게 경제적인 안정을 제공하고, 노후 생활을 보장하기 위한 정부의 제도입니다. 은퇴자들은 근로력을 잃게 되었지만, 사회 보장을 통해 일정한 수입을 받을 수 있습니다. 이를 통해 은퇴자들은 생활비를 지출하고, 의료비를 지불하며, 삶의 질을 유지할 수 있습니다. 사회 보장은 은퇴자들에게 안정감을 주고, 경제적인 부담을 줄여줍니다. 따라서 대부분의 은퇴자들은 사회 보장을 통해 안정적인 노후 생활을 할 수 있습니다."}, {"score": 0.077068925, "content": "사회 보장에서 전액 혜택을 받을 수 있는 나이는 증가하고 있다. 현재 사회 보장 제도에서는 점차적으로 연령 요건이 상향 조정되고 있으며, 이는 인구 구조 변화와 경제적인 이유로 인해 이루어지고 있다. 예전에는 일정한 나이에 도달하면 사회 보장 혜택을 받을 수 있었지만, 현재는 평균 수명이 증가하고 노동력 인구의 감소로 인해 이러한 변화가 필요하게 되었다. 이러한 변화는 사회 보장 제도의 재정적인 지속 가능성을 보장하기 위한 조치로 이루어지고 있다. 따라서, 현재 사회 보장에서 전액 혜택을 받을 수 있는 나이는 점차적으로 증가하고 있으며, 이는 사회적인 변화와 경제적인 이유로 인해 필요한 조치이다."}, {"score": 0.07327256, "content": "식품에 대한 권리는 사람들이 식품을 생산, 구매, 사회 보호 프로그램 또는 기타 수단을 통해 접근하는 경로를 의미합니다. 이는 모든 개인이 영양을 얻고 건강한 삶을 영위할 수 있는 권리입니다. 식품에 대한 권리는 인간의 기본적인 생존과 발전에 필수적입니다. 이 권리는 국제 인권법과 국가법에 의해 보호되고 있습니다. 식품에 대한 권리는 개인의 자유와 존엄성을 존중하는 것을 목표로 합니다. 이를 위해 정부와 사회는 식품 생산과 배급 시스템을 유지하고 개선하는 책임이 있습니다. 또한 식품에 대한 권리는 식품의 안전성과 품질을 보장하는 것을 포함합니다. 모든 사람들은 식품에 대한 권리를 가지며, 이를 통해 건강하고 안전한 식사를 할 수 있습니다. 식품에 대한 권리는 사회적 평등과 공정성을 추구하는 데 중요한 역할을 합니다. 이는 식품의 공급과 분배에 있어서 차별이 없고, 모든 사람들이 동등하게 식품에 접근할 수 있는 것을 의미합니다. 식품에 대한 권리는 우리 모두에게 중요한 주제이며, 이를 위해 우리는 식품 시스템을 지속적으로 개선해야 합니다."}]}
{"eval_id": 243, "standalone_query": "지구에서 땅속으로 물체가 꺼지거나 바깥으로 튕겨나가지 않는 이유", "topk": ["5ff8f00a-a4e6-43fd-8616-3104a4c4d637", "e17a3380-323d-4668-bed5-272502280045", "e535c747-8564-4dad-a74d-6b7a62403c37"], "references": [{"score": 0.103310004, "content": "지구의 중력이 발생하는 원인은 지구의 질량이다. 중력은 모든 물체 간에 작용하는 자연 법칙으로, 지구의 질량이 크기 때문에 지구 주변에 있는 물체들에게 중력을 발생시킨다. 이러한 중력은 물체를 지구로 끌어당기는 힘을 가지고 있으며, 이로 인해 물체들은 지구의 표면으로 떨어지게 된다. 중력은 우리가 일상적으로 경험하는 현상으로, 우리가 땅에 서 있을 수 있는 이유이기도 하다. 지구의 질량이 중력의 원인이 되는 이유는 뉴턴의 법칙에 따라 물체 간에는 질량에 비례하는 중력이 작용하기 때문이다. 따라서, 지구의 질량이 크기 때문에 지구의 중력도 크게 작용하게 되는 것이다."}, {"score": 0.0854282, "content": "목성형 행성들은 적도 부근에서 팽창, 즉 \"찌그러진\" 외관을 가지는 이유는 목성형 행성들의 빠른 회전이 적도 근처의 질량을 바깥쪽으로 튕겨내기 때문입니다. 이러한 행성들은 자전력에 의해 중력과 균형을 유지하며, 이로 인해 행성의 외부는 찌그러진 모양을 가지게 됩니다. 이러한 현상은 목성형 행성들의 특징 중 하나로 알려져 있으며, 이러한 외관은 많은 천문학자들에게 흥미로운 연구 주제가 되고 있습니다. 목성형 행성들은 우리가 알고 있는 지구와는 매우 다른 형태를 가지고 있으며, 이러한 찌그러진 외관은 그들의 독특한 특징 중 하나입니다. 이러한 행성들은 우주의 신비와 다양성을 보여주는 중요한 천체로 알려져 있으며, 우주 탐사의 대상으로도 많은 관심을 받고 있습니다."}, {"score": 0.082479134, "content": "지구 중력은 지구의 질량에 의해 직접적으로 결정됩니다. 지구는 매우 큰 질량을 가지고 있기 때문에 중력이 발생합니다. 중력은 모든 물체에 작용하며, 지구의 질량이 클수록 중력도 강해집니다. 이는 지구에서 떨어지는 물체들이 땅으로 떨어지는 이유입니다. 중력은 우리가 일상적으로 경험하는 현상 중 하나이며, 우리의 생활에 많은 영향을 미칩니다. 중력은 우리가 걷거나 물체를 들어올릴 때도 작용하며, 또한 지구의 자전과 관련하여 날씨, 해양 및 대기 현상에도 영향을 줍니다. 따라서 지구의 질량은 지구 중력의 직접적인 결과입니다."}]}
{"eval_id": 34, "standalone_query": "씨앗의 기능", "topk": ["55726582-8401-4a6f-889b-e9bd3953be7c", "08d7ebd9-60c7-48eb-b2e8-2d5af7eddb2b", "6335780f-292d-49da-a79c-3eee1d51a903"], "references": [{"score": 0.08164712, "content": "식물의 씨앗은 생명력을 지니고 있으며, 다양한 기능을 수행합니다. 그 중 한 가지 기능은 초기 발달에 필요한 음식을 제공하는 것입니다. 씨앗은 작고 작은 식물의 모습을 담고 있으며, 이 모습은 식물이 자라기 위해 필요한 영양분을 포함하고 있습니다. 씨앗은 흙 속에 심어지면 물과 영양분을 흡수하여 발아하고 자라나게 됩니다. 이렇게 씨앗은 식물의 초기 발달에 필요한 음식을 제공하여 식물이 건강하게 자라날 수 있도록 도와줍니다. 씨앗은 또한 환경 조건에 따라 발아하는 시기를 조절할 수도 있으며, 씨앗의 외부 껍질은 식물을 보호하고 안전하게 자라날 수 있도록 도와줍니다. 따라서 식물의 씨앗은 생명력을 유지하고 번식을 위한 중요한 역할을 수행하는 것입니다."}, {"score": 0.07469206, "content": "식물 씨앗은 생명력을 지니고 있으며, 식물의 번식과 성장에 중요한 역할을 합니다. 씨앗은 초기에 발달하는 동안 사용할 양분을 저장하는 기능을 가지고 있습니다. 이 양분은 식물이 자라고 성장하는 동안 필요한 에너지와 영양소를 제공합니다. 또한, 씨앗은 환경 조건이 적절해지면 발아하여 새로운 식물을 생성하는 역할을 합니다. 이러한 과정을 통해 식물은 생명을 유지하고 번식할 수 있습니다. 씨앗은 또한 외부 환경으로부터 식물을 보호하는 역할도 합니다. 강한 표면을 가지고 있어 외부 충격이나 건조한 환경으로부터 식물을 보호합니다. 따라서, 식물 씨앗은 식물의 생존과 번식을 위해 중요한 역할을 수행하는 것입니다."}, {"score": 0.065677434, "content": "식물이 자라기 위해서는 여러 가지 요소가 필요합니다. 그 중에서도 가장 필요한 것은 씨앗입니다. 씨앗은 작고 작은 싹을 틔우는 역할을 합니다. 씨앗은 흙 속에 심어지고, 물과 영양분을 흡수하여 싹을 틔우게 됩니다. 이 싹은 뿌리와 줄기, 잎을 갖게 되며, 이를 통해 식물은 자라나게 됩니다. 따라서, 씨앗은 식물이 자라기 위해 가장 필요한 것입니다."}]}
{"eval_id": 246, "standalone_query": "친환경 재생 가능 재료", "topk": ["f81c0a09-4082-4b6a-8546-12371ff89fba", "bfccf76f-2555-4963-9ea4-4be2419dafa7", "cc56ca24-fde0-458d-95f7-d3d31b79acb5"], "references": [{"score": 0.13098434, "content": "미국의 많은 지역사회에서는 석탄을 사용하여 전기를 생산합니다. 석탄은 저렴하고 효율적인 에너지원으로 알려져 있습니다. 그러나 석탄을 사용하는 데 있어서 한 가지 문제점이 있습니다. 바로 생태계가 손상될 수 있다는 점입니다. 석탄을 연소하면 대량의 이산화탄소와 유해 물질을 배출하게 되어 대기 오염을 초래할 수 있습니다. 이로 인해 공기와 물의 질이 저하되고, 동식물의 서식지가 파괴될 수 있습니다. 또한, 석탄 채굴은 지하수 오염과 토양 침식을 초래할 수 있으며, 광산 폐기물은 지역의 수질을 오염시킬 수 있습니다. 이러한 문제들은 지속 가능한 환경을 위협하고 생태계의 균형을 깨뜨릴 수 있습니다. 따라서 석탄을 대체할 수 있는 친환경적인 에너지원을 개발하고 보급하는 것이 중요합니다. 태양광, 풍력, 수력 등의 재생에너지는 석탄과 같은 에너지를 생산할 수 있으면서도 환경에 더욱 친숙한 선택입니다. 이러한 친환경 에너지원을 활용하여 전기 생산을 지속 가능하게 하고, 생태계를 보호하는 노력이 필요합니다."}, {"score": 0.12829773, "content": "석유는 재생 불가능한 에너지 자원입니다. 석유는 수백만 년 동안 지구의 지하에서 형성되었으며, 한 번 소모되면 다시 생성되지 않습니다. 석유는 우리가 일상적으로 사용하는 다양한 제품과 연료에 사용되며, 전 세계적으로 많은 수요가 있습니다. 그러나 석유는 한정된 자원이기 때문에 고갈될 우려가 있습니다. 이러한 이유로 석유 대체 에너지와 재생 가능한 에너지 자원에 대한 연구와 개발이 중요합니다. 재생 가능한 에너지 자원은 태양, 바람, 수력, 지열 등이 있으며, 이러한 자원은 지속적으로 이용할 수 있습니다. 따라서 석유의 한계를 극복하고 지속 가능한 미래를 위해 재생 가능한 에너지 자원에 대한 투자와 개발이 필요합니다."}, {"score": 0.12343104, "content": "미국의 많은 도시들이 친환경 공동체를 조성하고 있습니다. 이러한 친환경 공동체는 주택, 아파트 및 인근의 사업체들로 구성되어 있으며, 에너지 사용 절감을 목표로 합니다. 공동체 내에는 식료품점, 레스토랑, 영화관 등이 위치해 있어 주민들이 도보로 이동할 수 있습니다. 이로 인해 사람들의 등교 및 통근 거리가 짧아지고, 환경에 대한 부담도 줄어듭니다. 또한, 친환경 공동체의 많은 건물들은 재생 및 재활용 가능한 재료를 사용하여 지어졌습니다. 태양 에너지를 이용하여 건물 내부를 쾌적한 온도로 유지하고, 나무와 식물과 같은 자연물은 신중하게 배치되어 그늘을 제공하고 온도를 조절합니다. 또한, 공동체 내에는 주민들이 음식과 꽃을 재배할 수 있는 정원도 마련되어 있습니다. 하지만, 친환경 공동체의 사람들이 재생 불가 자원을 사용하는 경우도 있습니다. 예를 들어, 가솔린으로 움직이는 자동차를 운전할 때는 환경에 부정적인 영향을 미칠 수 있습니다. 따라서 친환경 공동체의 주민들은 자동차 대신 대중교통이나 자전거를 이용하여 환경을 보호하는 노력을 해야 합니다."}]}
