{"eval_id": 77, "standalone_query": "새로운 생명체의 발생에 대한 오래된 믿음을 깨기 위해 사용된 방법", "topk": ["5b8fa65f-9a69-4990-8618-50aa1911e3ec", "14c6829d-80d8-4609-bab3-2309b9704f0a", "d92388f6-ec82-4f43-b67f-0e26bcb0c394"], "references": [{"score": 0.15234123, "content": "생명체가 살아있지 않은 물질에서 발생할 수 있다는 생각은 한때 사람들 사이에서 퍼져있었습니다. 예를 들어, 부패한 육류에서 파리가 생겨난다는 믿음이 있었습니다. 그러나 이러한 생각이 반증된 이유는 주로 계속된 실험 때문입니다. 과학자들은 여러 실험을 통해 생명체의 발생은 단순히 부패한 물질에서 일어나는 것이 아니라는 것을 밝혀냈습니다. 실험 결과를 통해 생명체의 발생은 생명체 자체의 번식과정을 거쳐야만 가능하다는 것이 입증되었습니다. 이러한 실험들은 과학적인 방법과 철저한 분석을 통해 이루어졌으며, 이를 통해 생명체의 발생과정에 대한 이해가 더욱 확장되었습니다. 따라서, 생명체의 발생은 단순히 부패한 물질에서 일어나는 것이 아니라는 것이 실험을 통해 밝혀진 사실입니다."}, {"score": 0.10739782, "content": "얼음이 지구의 표면을 변화시키는 두 가지 방법은 바위를 깨고 U자형 계곡을 만드는 것입니다. 얼음은 자연 현상 중 하나로, 지구의 빙하와 빙산에서 발생합니다. 빙하는 대륙의 일부를 덮고 있으며, 빙산은 바다에 떠다니는 얼음입니다. 이러한 얼음은 지구의 표면을 변화시키는 두 가지 주요한 방법 중 하나입니다. 첫 번째 방법은 바위를 깨는 것입니다. 얼음은 빙하나 빙산 위에서 압력을 받으면 바위를 깨고 파손시킬 수 있습니다. 이 과정에서 얼음은 빙하나 빙산의 표면을 부드럽게 만들고, 지형을 변화시킵니다. 두 번째 방법은 U자형 계곡을 만드는 것입니다. 얼음은 빙하나 빙산 위에서 녹을 때 물이 흐르는 경로를 만들 수 있습니다. 이러한 물의 흐름은 지형을 깊게 파고들어 U자형 계곡을 형성합니다. 이렇게 얼음은 지구의 표면을 변화시키는 두 가지 주요한 방법을 통해 지형을 형성하고 변화시킵니다."}, {"score": 0.09331034, "content": "후기 대폭격은 약 38억 년 전에 혜성이 지구에 광범위하게 충돌한 시기였습니다. 이 충돌은 지구 시스템의 수권에서 현재 발견되는 대부분의 물질을 제공했다고 과학자들은 믿고 있습니다. 혜성의 충돌로 인해 지구는 수많은 물질을 획득하였고, 이는 지구의 환경과 생명체의 진화에 큰 영향을 미쳤습니다. 이 충돌은 지구의 지각적 변화와 함께 대량 멸종과 새로운 생명체의 등장을 초래했습니다. 현재의 지구는 후기 대폭격으로 인해 혜성의 충돌로부터 얻은 물질로 이루어져 있으며, 이는 우리가 살아 숨쉬고 있는 환경의 기반이 되고 있습니다. 과학자들은 이러한 충돌로 인해 혜성이 지구에 떨어진 물질이 수권에 퍼져나갔고, 이로 인해 지구의 바다와 호수, 강 등의 물이 형성되었다고 추정하고 있습니다. 이러한 물질은 생명체의 생존과 진화에 중요한 역할을 하였으며, 현재의 지구 생태계를 형성하는 데에도 영향을 미쳤습니다. 따라서 후기 대폭격은 지구의 역사와 생명체의 진화에 있어서 중요한 사건 중 하나입니다."}]}
{"eval_id": 250, "standalone_query": "협곡이 형성되는 과정", "topk": ["a06ea0ff-67d9-4967-bbe2-0d9022551740", "1f70c6f1-f1a7-44be-90d6-d397bace344b", "33dba7e5-0fbe-4294-b101-886838accf6c"], "references": [{"score": 0.100080304, "content": "강은 수천 년 동안 강둑을 침식하고, 침식된 물질을 입구에 놓습니다. 이 과정에서 강은 두 가지 주요한 지형을 형성합니다. 첫 번째는 삼각주입니다. 강둑을 침식하면서 강은 삼각주를 형성하는데, 이는 강의 흐름 방향에 따라 삼각형 모양의 지형을 만들어냅니다. 두 번째는 협곡입니다. 강둑을 침식하면서 강은 협곡을 형성하는데, 이는 강의 흐름에 따라 깊은 도랑 모양의 지형을 만들어냅니다. 이렇게 강이 만든 삼각주와 협곡은 자연의 아름다움을 간직하고 있으며, 많은 사람들에게 관광 명소로 알려져 있습니다."}, {"score": 0.093212776, "content": "강은 계곡과 협곡을 형성하는 주요한 요소입니다. 강은 수많은 물들이 모여 흐르는 자연적인 흐름입니다. 강은 지형을 깊게 파고들어 계곡과 협곡을 형성합니다. 강물은 강력한 힘을 가지고 있어서 흙과 바위를 침식시키고, 이로 인해 계곡과 협곡이 형성됩니다. 강은 자연의 힘과 영향력을 보여주는 중요한 지형 요소입니다."}, {"score": 0.04635674, "content": "퇴적암은 지구의 표면에서 일어나는 자연 현상 중 하나입니다. 이러한 퇴적암의 형성 과정은 여러 단계로 이루어집니다. 첫 번째 단계는 침식입니다. 침식은 풍화, 강물, 파도 등에 의해 암석이 부서지고 운반되는 과정을 말합니다. 이러한 침식 작용은 시간이 지남에 따라 퇴적물을 형성하게 됩니다. 따라서 퇴적암의 형성 과정에서 첫 번째 단계는 침식입니다."}]}
{"eval_id": 68, "standalone_query": "숫자 계산 operator 우선순위", "topk": ["59ce17a4-82be-4e0c-adbd-3ef4fd4e8a33", "21ea48b8-b053-4b2d-a1d8-d3ad15e548d7", "dd649890-597f-49ec-992f-eba8ed26c637"], "references": [{"score": 0.14703193, "content": "파이썬 표현식 1 + 3 % 3의 값은 1입니다. 파이썬에서는 연산자 우선순위에 따라 계산을 수행합니다. 우선 % 연산자는 나머지를 구하는 연산자이며, 3을 3으로 나눈 나머지는 0입니다. 따라서 1 + 0은 1이 됩니다. 파이썬은 수학적인 규칙에 따라 계산을 수행하기 때문에, 이와 같은 결과가 나오게 됩니다."}, {"score": 0.13898784, "content": "파이썬에서 4 + 3 % 2는 5의 값을 가집니다. 이는 파이썬의 연산자 우선순위에 따라 계산되며, 먼저 3 % 2를 계산하면 1이 나옵니다. 그리고 4와 1을 더하면 최종적으로 5가 됩니다. 파이썬은 산술 연산을 할 때, 나눗셈, 곱셈, 나머지 연산을 먼저 수행하고, 그 다음에 덧셈과 뺄셈을 수행합니다. 따라서, 4 + 3 % 2는 4 + 1로 계산되어 5가 됩니다."}, {"score": 0.08187557, "content": "BCD(Binary Coded Decimal)는 10진수를 4비트 이진수로 표현하는 방식입니다. 따라서 하나의 BCD 숫자를 저장하는 데에는 4개의 비트가 필요합니다. 이는 각각의 비트가 0부터 9까지의 10진수 값을 나타낼 수 있기 때문입니다. BCD는 컴퓨터 시스템에서 숫자를 표현하고 처리하는 데에 사용되며, 정확한 숫자 표현과 연산을 위해 사용됩니다. 따라서 BCD 숫자를 저장하기 위해서는 4개의 비트가 필요합니다."}]}
{"eval_id": 86, "standalone_query": "담수가 가장 많이 있는 곳", "topk": ["71282cc9-ca9c-4ab2-8e6d-724d1addf667", "470f3a4b-268f-49ac-ba4d-d1fc75c2d271", "d2762c95-6397-44b5-b20e-81d4b333dd69"], "references": [{"score": 0.07637556, "content": "담수와 염수가 강어귀에서 만나면, 염수는 일반적으로 담수 아래로 흐르는데 그 이유는 염수가 밀도가 더 높기 때문입니다. 이러한 현상은 해안에서 퍼져나가는 과정을 통해 발생합니다. 해안에서 염수가 담수와 만나면, 염수는 담수보다 더 높은 염분 농도를 가지고 있기 때문에 담수 아래로 흐르게 됩니다. 이러한 현상은 담수에 농축된 영양분에도 영향을 미칩니다. 염수가 담수로 흐르면서 담수에 농축된 영양분도 함께 퍼져나가게 되어, 해안 생태계에 영양분을 공급하게 됩니다. 따라서, 염수가 해안에서 퍼져나가는 것이 담수에 농축된 영양분에 가장 가능성이 높은 영향을 미치는 것으로 생각됩니다."}, {"score": 0.06918998, "content": "빙상은 가장 많은 양의 담수를 포함하는 종류의 물 저장소입니다. 빙상은 대부분의 경우 빙하나 빙산으로 형성되며, 빙하는 대륙의 깊은 내부에 위치하고 있습니다. 빙하는 눈과 얼음으로 이루어져 있으며, 많은 양의 물을 저장할 수 있습니다. 빙산은 빙하에서 분리되어 바다로 흘러내리는 얼음 덩어리입니다. 빙산은 대부분 바다 위에 떠 있지만, 때로는 해저에서 발견되기도 합니다. 빙산은 빙하와 마찬가지로 많은 양의 담수를 저장할 수 있으며, 이는 인류에게 중요한 물 공급원이 될 수 있습니다. 따라서, 빙상은 가장 많은 양의 담수를 포함하는 종류의 물 저장소입니다."}, {"score": 0.062630534, "content": "물의 순환 과정은 지구에서 물의 움직임을 설명합니다. 지구의 물 중 약 96%는 바다에서 발견되는 염수이며 나머지 4%는 담수입니다. 담수는 지구상 대부분의 물 중 일부를 차지하고 있습니다. 대부분의 담수는 만년설과 빙하에서 발견할 수 있습니다. 만년설은 영구적으로 얼어있는 눈과 얼음으로 이루어져 있으며, 빙하는 대량의 얼음으로 이루어진 대지입니다. 이러한 빙하와 만년설은 녹아서 물이 되고, 이 물은 강이나 호수로 흐르게 됩니다. 이렇게 흐르는 물은 지하수로 흡수되거나 바다로 흘러가게 됩니다. 따라서 만년설과 빙하는 지구상에서 대부분의 담수를 공급하는 중요한 역할을 합니다."}]}
{"eval_id": 232, "standalone_query": "폭풍을 쫓는 사람들", "topk": ["af4a89a5-4fe3-4655-88d7-fd2fcd118441", "9f205aa8-75fd-49e4-8961-bdb3da1a3851", "8afb522c-1123-4e99-aef2-80beaa37ae82"], "references": [{"score": 0.15475985, "content": "폭풍을 쫓는 자들은 폭풍을 관찰하고 측량하기 위해 폭풍에 가까이 다가가는 사람들입니다. 이들은 폭풍의 움직임, 구조, 성질 등을 연구하여 폭풍 형성 이론을 발전시키는 데 기여하고 있습니다. 그 중에서도 폭풍 시작 시 수집한 데이터가 폭풍 형성 이론을 가장 많이 수정하는 데 도움이 되었습니다. 이 데이터는 폭풍의 초기 조건과 환경 요소를 포착하여 폭풍의 발달과 진화에 대한 이해를 높이는 데 도움이 되었습니다. 폭풍을 쫓는 자들은 이러한 데이터를 분석하고 해석하여 폭풍 형성 이론을 수정하고 개선하는 데 중요한 역할을 하고 있습니다. 이를 통해 우리는 폭풍의 원리와 특성을 더욱 깊이 이해할 수 있게 되었습니다."}, {"score": 0.070990905, "content": "작은 섬에는 다양한 종류의 새들이 서식하고 있습니다. 이들 새들은 폭풍이라는 자연 현상으로부터 많은 어려움을 겪고 있습니다. 폭풍은 새들이 먹이를 찾고 둥지를 짓는 데 사용하는 식물들을 파괴하고 많은 피해를 입힙니다. 그러나 섬에 살아남을 가능성이 가장 높은 새는 바로 가장 적응력이 뛰어난 새들입니다. 이들 새들은 폭풍이 일어나면 다른 식물이나 자원을 활용하여 생존하는 방법을 찾아냅니다. 그들은 새로운 먹이원을 찾거나, 다른 종류의 식물을 이용하여 둥지를 짓는 등의 전략을 사용합니다. 이러한 적응력이 뛰어난 새들은 섬에서 살아남을 가능성이 가장 높으며, 섬의 생태계를 유지하는 데 중요한 역할을 합니다."}, {"score": 0.053630833, "content": "태양은 폭풍이 비 형태로 물을 이동시키는 과정을 시작하는 에너지원입니다. 태양은 뜨거운 플라즈마로 이루어진 별로, 강력한 중력과 핵융합 반응을 통해 엄청난 양의 에너지를 생성합니다. 이 에너지는 태양의 표면에서 방출되어 지구로 향하게 되는데, 이때 일부 에너지는 대기 중의 수분을 가열하여 수증기로 변화시킵니다. 수증기는 대기 중에서 상승하면서 높은 고도로 이동하게 되는데, 이때 폭풍이 형성되고 비가 내리게 됩니다. 따라서 폭풍이 비 형태로 물을 이동시키는 과정은 태양의 에너지에 의해 시작되는 것입니다."}]}
{"eval_id": 109, "standalone_query": "우라늄을 사용한 원자력 발전의 단점", "topk": ["cb255f81-71ed-437e-8cb0-5039c967fb19", "ea3c3d73-25ac-4a52-bbbf-6307ff51ff22", "517f2e40-f048-40bc-8d48-162c56d6ec77"], "references": [{"score": 0.12905493, "content": "원자력 사용과 관련하여 주요 쟁점 사안이 아닌 것은 다음과 같습니다:\n\n1. 원자력 발전소의 안전 문제: 원자력 발전소는 핵분열로 전기를 생산하는데 사용되는데, 이는 핵물질의 사용과 관련이 있어 안전 문제가 주요한 이슈입니다. 원자력 발전소의 폭발이나 누설로 인한 방사능 오염은 인명 피해와 환경 파괴를 초래할 수 있습니다.\n\n2. 핵폐기물 처리 문제: 원자력 발전은 핵분열로 인해 방사성 폐기물을 생성합니다. 이러한 폐기물은 장기적으로 안전하게 처리되어야 하는데, 이를 위한 적절한 방법과 시설이 필요합니다. 핵폐기물 처리 문제는 환경 오염과 안전 문제를 야기할 수 있습니다.\n\n3. 원자력 발전의 경제성: 원자력 발전소의 건설 및 운영은 많은 비용이 소요됩니다. 이에 따라 원자력 발전이 경제적으로 효율적인지에 대한 논란이 있습니다. 원자력 발전소의 건설 비용, 연료 비용, 폐기물 처리 비용 등을 고려하여 원자력 발전의 경제성을 평가해야 합니다.\n\n4. 원자력 발전과 환경 문제: 원자력 발전은 탄소 배출량이 적어 기후 변화에 대한 해결책으로 주목받고 있습니다. 그러나 원자력 발전소의 건설과 운영에는 환경 파괴가 동반될 수 있습니다. 원자력 발전소의 건설로 인한 자연 생태계의 파괴와 수자원 오염 등이 주요한 환경 문제입니다.\n\n원자력으로의 전환으로 인한 실업은 원자력 사용과 관련하여 주요 쟁점 사안이 아닙니다. 이는 원자력 발전소의 운영에 따른 일자리 창출과 관련된 문제로, 원자력 발전의 장점과 단점을 고려하여 평가되어야 합니다."}, {"score": 0.11187683, "content": "우라늄 핵이 분열할 때 방출되는 에너지의 주요 형태는 핵분열의 파편의 운동 에너지입니다. 핵분열은 원자핵이 분열되면서 파편이 발생하고, 이 파편들은 높은 속도로 운동하게 됩니다. 이 운동 에너지는 분열 과정에서 방출되는 주요 형태의 에너지입니다. 이러한 운동 에너지는 원자력 발전소에서 전기를 생산하는 데 사용될 수 있습니다. 또한, 핵분열의 파편의 운동 에너지는 핵무기의 작동 원리에도 관여합니다. 핵무기는 핵분열 반응을 이용하여 엄청난 폭발을 일으키는데, 이 폭발은 파편들의 운동 에너지로 인해 발생합니다. 따라서, 핵분열의 파편의 운동 에너지는 우라늄 핵이 분열할 때 방출되는 에너지의 주요 형태입니다."}, {"score": 0.09557079, "content": "핵분열을 겪는 우라늄 원자의 질량과 비교했을 때, 분열 후의 결과물들의 combined 질량은 더 작다. 핵분열은 원자핵이 분열되어 두 개의 작은 원자핵으로 분해되는 과정이다. 이 과정에서 일부 질량이 에너지로 변환되기 때문에, 분열 후의 결과물들의 combined 질량은 분열 전의 우라늄 원자의 질량보다 작아진다. 이는 알버트 아인슈타인의 질량-에너지 등식인 E=mc^2에 기반한 결과이다. 따라서, 핵분열을 겪는 우라늄 원자의 질량과 비교했을 때, 분열 후의 결과물들의 combined 질량은 더 작다."}]}
{"eval_id": 1, "standalone_query": "고체에서 액체로 변할 때 엔트로피 변화", "topk": ["4a8549c8-8e81-4804-9df9-852952dd5747", "3fe7e12f-e099-4cdb-9d56-c082789ade21", "7df24852-c758-4a4e-8ca7-0bd5a7205881"], "references": [{"score": 0.14487469, "content": "고체가 녹을 때, 엔탈피와 엔트로피는 양적으로 변화합니다. 엔탈피 변화는 양적으로 증가하며, 엔트로피 변화도 양적으로 증가합니다. 이는 고체가 녹을 때 분자 간의 상호작용이 늘어나고, 분자의 자유도가 증가하기 때문입니다. 따라서, 고체가 녹을 때는 엔탈피와 엔트로피가 양적으로 변화하게 됩니다."}, {"score": 0.11263135, "content": "액체 상태의 물 분자의 움직임이 느려졌을 때, 일반적으로 액체 상태의 물이 고체로 변하는 현상이 가장 가능성이 높습니다. 이는 물 분자들이 서로에게 더 가까이 모여들어 결합력이 강해지기 때문에 발생합니다. 이러한 현상은 주로 낮은 온도에서 관찰되며, 물 분자들이 서로에게서 멀어지는 열운동이 감소하면서 발생합니다. 따라서, 액체 상태의 물 분자의 움직임이 느려졌을 때, 가장 가능성이 높은 일은 액체 상태의 물이 고체로 변하는 것입니다."}, {"score": 0.10746992, "content": "달걀은 삶을 때 열이 달걀의 화학적 결합을 바꿉니다. 그녀는 졸리는 아침 식사로 삶은 달걀을 먹고 싶었기 때문에 달걀을 끓는 물에 15분 동안 넣었습니다. 그녀가 껍데기를 깠을 때, 달걀의 액체 부분은 고체가 되어 있었습니다. 이것은 열이 달걀의 화학적 결합을 바꾸었기 때문입니다. 삶은 달걀은 부드럽고 고체로 변하며, 달걀의 단백질이 응고되어 액체가 고체로 변합니다. 이러한 변화는 열에 의해 달걀 내부의 분자 구조가 변화함으로써 일어납니다. 따라서, 삶은 달걀을 먹을 때는 달걀의 화학적 변화를 고려해야 합니다."}]}
{"eval_id": 28, "standalone_query": "사회로부터의 감정적인 지원 형태", "topk": ["03390467-c6dc-4242-a039-c7e9a8bb242f", "7cf0214f-57fa-4b19-9aa4-2e04541a5aac", "fabd5549-84e5-4b45-8c6b-261773e3311a"], "references": [{"score": 0.12257458, "content": "감정적인 지원은 사회적 지원의 한 유형입니다. 이는 당신의 여동생 Patricia가 우울해할 때 그녀를 위로하고 행복했던 시절을 회상하여 제공한 지원입니다. 감정적인 지원은 당신이 Patricia에게 따뜻한 말과 격려를 전하며, 그녀의 감정을 이해하고 공감하는 것을 포함합니다. 이러한 지원은 Patricia에게 안정감과 위로를 제공하여 그녀가 어려운 시기를 극복할 수 있도록 도와줍니다. 감정적인 지원은 사람들 간의 관계를 강화하고 서로에게 희망과 힘을 줄 수 있는 중요한 요소입니다."}, {"score": 0.110104024, "content": "사회적 지원이 건강과 웰빙에 가장 긍정적인 영향을 미칠 가능성이 높은 경우는 지원으로 인식될 때입니다. 사회적 지원은 개인이나 집단에게 제공되는 형태로, 이는 경제적, 정서적, 정보적 등 다양한 형태로 이루어질 수 있습니다. 이러한 지원은 개인의 사회적 연결성을 강화하고, 스트레스를 완화하며, 자아존중감을 향상시키는데 도움을 줄 수 있습니다. 또한, 사회적 지원은 개인의 건강과 웰빙을 촉진시키는데 중요한 역할을 할 수 있습니다. 지원을 받는 것은 개인의 사회적 지위와 자원에 대한 인식을 높여주며, 이는 개인의 건강과 웰빙에 긍정적인 영향을 미칠 수 있습니다. 따라서, 사회적 지원이 건강과 웰빙에 가장 긍정적인 영향을 미칠 가능성이 높은 경우는 지원으로 인식될 때입니다."}, {"score": 0.10142508, "content": "장수는 사회적 지원과 높은 수준의 강한 관련이 있습니다. 사회적 지원은 개인이나 집단이 사회적으로 안정되고 안전한 환경에서 살 수 있도록 도와주는 요소입니다. 이는 경제적인 지원, 교육, 의료, 주거 등 다양한 형태로 제공될 수 있습니다. 사회적 지원은 개인의 복지와 행복을 증진시키는 데 중요한 역할을 합니다. 이를 통해 개인은 자신의 잠재력을 최대한 발휘할 수 있고, 사회적으로 성취를 이룰 수 있습니다. 따라서, 장수를 위해서는 사회적 지원이 필수적인 요소입니다."}]}
{"eval_id": 203, "standalone_query": "석탄을 에너지원으로 사용할 때의 장단점", "topk": ["f81c0a09-4082-4b6a-8546-12371ff89fba", "5d0b8a0b-0864-4458-aa23-4cdf8719916f", "c67c5684-b931-4220-ac15-d687e1153d1d"], "references": [{"score": 0.12015249, "content": "석탄과 태양은 에너지원으로서 비교될 수 있습니다. 석탄은 재생 불가능한 에너지원으로, 한 번 사용하면 다시 생성되지 않습니다. 이는 석탄이 유한한 자원이기 때문입니다. 반면에 태양은 재생 가능한 에너지원으로, 태양광 발전을 통해 계속해서 에너지를 생산할 수 있습니다. 태양은 무한한 자원이기 때문에 태양광 발전은 지속 가능한 에너지 솔루션으로 간주됩니다. 따라서 석탄과 태양은 에너지원으로서 서로 다른 특징을 가지고 있습니다."}, {"score": 0.119976476, "content": "로이의 선생님은 그에게 자연에서 쉽게 대체되지 않는 에너지 원을 식별할 것을 요청했습니다. 로이는 석탄을 식별해야 합니다. 석탄은 화석 연료로서, 지구의 지하에서 수백만 년 동안 형성된 유기물의 고도로 탄화된 형태입니다. 석탄은 전기 생산, 난방, 산업 프로세스 등 다양한 용도로 사용됩니다. 그것은 안정적이고 효율적인 에너지 공급을 제공하며, 많은 국가에서 주요한 에너지 원으로 사용되고 있습니다. 석탄은 자연에서 쉽게 대체되지 않는 에너지 원으로 인정받고 있습니다."}, {"score": 0.11256401, "content": "석탄 발전소는 화학 에너지를 전기 에너지로 변환하기 위해 설계되었습니다. 석탄은 화학 에너지를 가지고 있으며, 이를 연소시켜 열 에너지로 변환합니다. 이 열 에너지는 수증기를 생성하여 터빈을 회전시키고, 이를 통해 전기를 생산합니다. 석탄 발전소는 대량의 석탄을 사용하여 전기를 생산하는 중요한 에너지원입니다. 석탄 발전소는 환경 문제를 일으킬 수 있지만, 최근에는 환경 친화적인 기술과 시스템을 도입하여 이 문제를 해결하려고 노력하고 있습니다. 석탄 발전소는 전 세계적으로 많이 사용되는 발전 방식 중 하나이며, 전기를 공급하는 데 중요한 역할을 합니다."}]}
