{"eval_id": 224, "standalone_query": "네트워크 분석을 위한 traffic sniffing", "topk": ["7c75080c-5d8f-41e2-ad26-c90ad3f671b0", "f75d3717-24c8-41e6-a78d-ea6f92444209", "5f206999-c7fc-4252-aa37-27655345e78d"], "references": [{"score": 0.25884598, "content": "무선 트래픽 스니핑은 포렌식 조사 시 또는 무선 문제 해결 중 도움이 될 수 있는 무선 트래픽 분석 과정입니다. 이 과정은 무선 네트워크에서 전송되는 데이터를 감시하고 분석하여 문제를 해결하거나 증거를 수집하는 데 사용됩니다. 무선 트래픽 스니핑은 무선 네트워크의 보안 취약점을 식별하고 해결하는 데 도움이 됩니다. 또한, 무선 트래픽 스니핑은 무선 네트워크의 성능을 평가하고 최적화하는 데에도 활용됩니다. 이 과정은 무선 통신 프로토콜과 네트워크 구조에 대한 이해를 기반으로 수행되며, 전문적인 도구와 기술이 필요합니다. 무선 트래픽 스니핑은 무선 네트워크 관련 문제를 해결하는 데에 큰 도움이 되는 중요한 과정입니다."}, {"score": 0.1857142, "content": "에터피크는 다양한 프로토콜 네트워크에서 네트워크 분석에 널리 사용되는 도구입니다. 이 도구는 네트워크 트래픽을 모니터링하고 분석하여 네트워크의 동작과 문제를 파악할 수 있습니다. 에터피크는 패킷 스니핑 기능을 제공하여 네트워크 상에서 전송되는 데이터를 실시간으로 캡처하고 분석할 수 있습니다. 또한, 에터피크는 다양한 프로토콜을 지원하여 TCP/IP, 이더넷, Wi-Fi 등 다양한 네트워크 환경에서 사용할 수 있습니다. 이를 통해 네트워크 관리자는 네트워크의 성능, 보안 및 문제점을 신속하게 파악하고 대응할 수 있습니다. 에터피크는 네트워크 분석에 필수적인 도구로 알려져 있으며, 많은 기업과 조직에서 네트워크 관리에 활용하고 있습니다."}, {"score": 0.12648495, "content": "패킷 필터 방화벽은 네트워크 또는 전송 계층에서 필터링을 수행합니다. 이 방화벽은 네트워크 트래픽을 모니터링하고, 특정한 규칙에 따라 패킷을 허용하거나 차단합니다. 이러한 필터링 위치는 네트워크와 전송 계층에서 이루어지며, 이를 통해 네트워크 보안을 강화할 수 있습니다. 패킷 필터 방화벽은 IP 주소, 포트 번호, 프로토콜 등 다양한 요소를 기반으로 패킷을 분석하고 처리합니다. 이를 통해 악성 트래픽이나 불필요한 트래픽을 차단하여 네트워크의 안전성을 유지합니다. 패킷 필터 방화벽은 네트워크 보안의 핵심 요소로서, 기업이나 개인의 네트워크를 보호하는 데 중요한 역할을 합니다."}]}
{"eval_id": 12, "standalone_query": "벽돌공의 영향력", "topk": ["9b7bc48a-6e0c-450c-8364-a7da2ac4d4d4", "077c844a-c03a-4d7f-99c2-e402e62f12af", "58efaaad-4d36-4dc4-953d-9f2eeaa9fda5"], "references": [{"score": 0.08346101, "content": "벽돌공의 아들은 대학에 진학하여 의과 대학에서 교사가 되었습니다. 그리고 시간이 흐르면서 그는 종신 교수로 승진하였습니다. 그러나 그의 열정은 그것으로 끝나지 않았습니다. 그는 다른 학교에서의 새로운 종신 교수 직위를 위해 전국을 이동하였습니다. 이렇게 순차적으로, 이 남자는 아버지에 대한 세대 간 이동, 상향 이동, 수평 이동 등 다양한 경험을 하였습니다. 그의 열정과 노력 덕분에 그는 자신의 꿈을 이루었고, 많은 사람들에게 영감을 주었습니다."}, {"score": 0.062428318, "content": "한 공이 끈적였고 다른 공은 매끄러웠기 때문에 한 공이 다른 공보다 더 빨리 경사면을 굴러 내려갔습니다. 끈적이는 공은 표면에 접착력이 높아서 경사면과의 마찰이 더 강력하게 작용하게 됩니다. 반면에 매끄러운 공은 표면과의 마찰이 상대적으로 약해져서 경사면을 더 빠르게 굴러 내려갈 수 있습니다. 따라서, 끈적이는 공이 매끄러운 공보다 더 빨리 굴러간 것입니다."}, {"score": 0.06241824, "content": "전기력은 전하 사이에 작용하는 힘입니다. 이 문제에서는 두 개의 전기를 띠는 공이 짧은 거리로 분리되어 있고, 그 사이에 50μN의 힘이 발생한다고 주어졌습니다. 각 공의 전하는 동일하게 유지되면서, 한 공의 질량만 두 배로 증가시킵니다.\n\n전기력은 전하의 크기와 거리에 비례하며, 전하의 크기와 질량은 독립적인 개념입니다. 따라서 한 공의 질량이 두 배로 증가하더라도, 다른 공의 전하는 변하지 않습니다.\n\n따라서, 공 사이의 새로운 전기 힘은 여전히 50μN입니다."}]}
{"eval_id": 33, "standalone_query": "파이썬 list에서 가장 작은 값 찾는 함수", "topk": ["eab2a705-18b6-4bbe-84f4-acacb4cd8a1f", "5b53496d-48dd-4899-9d45-11f55456cdba", "0ead6efd-e477-461a-b609-29fcb7c5d038"], "references": [{"score": 0.25670448, "content": "파이썬3에서 min(l)은 리스트 l의 요소 중 가장 작은 값을 반환합니다. 예를 들어, l = [1,2,3,4]라고 할 때, min(l)은 1을 반환합니다. 이는 리스트 l의 요소들 중에서 가장 작은 값인 1을 찾아주는 함수입니다. 파이썬에서 min() 함수는 숫자뿐만 아니라 문자열, 튜플 등 다양한 자료형에 대해서도 동작합니다. 따라서, min() 함수는 어떤 자료형이든지 가장 작은 값을 찾아주는 유용한 함수입니다."}, {"score": 0.177266, "content": "파이썬3에서 sum(l)은 리스트 l의 모든 요소를 더한 값을 반환합니다. 예를 들어, l = [1,2,3,4]라고 할 때, sum(l)은 1+2+3+4인 10을 반환합니다. sum() 함수는 파이썬 내장 함수로, 리스트뿐만 아니라 다른 iterable 객체에도 적용할 수 있습니다. 이 함수를 사용하면 간단하게 리스트의 모든 요소를 더할 수 있습니다."}, {"score": 0.1769024, "content": "파이썬3에서 max 함수는 주어진 리스트에서 가장 큰 값을 반환합니다. 예를 들어, l = [1,2,3,4]라고 할 때, max(l)은 4를 반환합니다. 이는 리스트 l에 포함된 값 중에서 가장 큰 값인 4를 찾아주는 기능을 수행합니다. 따라서, max(l)은 4입니다."}]}
{"eval_id": 240, "standalone_query": "글루텐이 에너지 흡수에 미치는 영향", "topk": ["01684b2f-9360-4d70-93b1-05adb631aa62", "c3829f80-57bf-4db6-9e06-dd81b8bb6148", "a49df95f-7ef0-406c-a346-50609a6dbaea"], "references": [{"score": 0.14362633, "content": "글루텐은 탄수화물 흡수 불량을 증가시킬 수 있습니다. 글루텐은 밀, 보리, 쌀 등의 곡물에 포함되어 있으며, 일부 사람들은 글루텐에 민감할 수 있습니다. 글루텐 민감성은 소화기계의 기능에 영향을 주어 탄수화물 흡수에 문제를 일으킬 수 있습니다. 이로 인해 소화기계가 글루텐을 처리하는 데 어려움을 겪을 수 있으며, 결과적으로 탄수화물 흡수 불량이 발생할 수 있습니다. 탄수화물은 우리 몸에 필요한 에너지원이므로, 글루텐 민감성이 있는 사람들은 글루텐을 제한하거나 피하는 것이 좋습니다. 이를 통해 탄수화물 흡수 불량을 예방하고 건강을 유지할 수 있습니다."}, {"score": 0.060836617, "content": "태양 에너지가 지구의 대기에 미치는 영향을 결정하는 데 이용하기 위한 척도로 가장 적합한 것은 공기 온도입니다. 공기 온도는 태양 에너지의 흡수와 방출에 직접적인 영향을 미치며, 대기의 열전달과 대류에도 영향을 줍니다. 태양 에너지는 공기 온도에 따라 대기 중의 수증기와 구름 형성, 대류 운동 등을 통해 지구의 기후와 날씨를 형성합니다. 따라서 공기 온도는 태양 에너지의 지구 대기에 대한 영향을 결정하는 중요한 척도입니다."}, {"score": 0.056643978, "content": "지구의 지질학적 역사 전반에 있어 대륙 이동은 지구의 기후 주기에 큰 영향을 끼쳤습니다. 과학자들은 대륙 이동이 지구의 따뜻했다 차가워지는 기후 주기에 영향을 미쳤다고 믿고 있습니다. 이러한 대륙 이동 시 전 세계 기후에 변화를 일으킬 가능성이 가장 높은 지구 대륙의 특성은 대륙 위치입니다. 대륙 위치는 해당 대륙의 표면 반사율에 영향을 미치며, 이는 태양 에너지의 흡수와 반사에 영향을 줍니다. 따라서 대륙의 위치가 변하면 태양 에너지의 분배가 변하고, 이는 기후 변화를 초래할 수 있습니다."}]}
{"eval_id": 252, "standalone_query": "해구가 생기는 이유", "topk": ["9f51187f-8895-43a5-820f-790a9e36d49a", "9f51187f-8895-43a5-820f-790a9e36d49a", "3a337b5d-0424-47ed-aba1-c18acce78d9c"], "references": [{"score": 0.08806497, "content": "지각판 발산은 지각판이 분리되어 발산하는 현상을 말합니다. 이는 지각판이 지구 표면에서 벗어나는 것을 의미합니다. 그러나 해구는 지각판 발산의 결과로 형성되지 않는 특징입니다. 해구는 해양 지형으로, 해양 표면 아래에 있는 분지로 형성됩니다. 따라서 해구는 지각판 발산과는 관련이 없는 지형 현상입니다."}, {"score": 0.08588319, "content": "섭입대는 대륙 지각과 해양 지각이 충돌하는 지점을 나타내는 지질 현상입니다. 이러한 충돌 지점에서는 다양한 지질 특성이 관찰될 수 있습니다. 그 중 하나는 해구입니다. 해구는 해양 지각이 대륙 지각을 침식하여 형성된 해안 지형입니다. 해구는 흐르는 물의 힘에 의해 형성되며, 대개 반달 모양을 가지고 있습니다. 이러한 해구는 섭입대의 끝 부분에 위치할 수 있으며, 섭입대의 지질 특성 중 하나로 포함될 수 있습니다. 섭입대의 다른 지질 특성으로는 퇴적층, 암석의 굽은 형태, 균열 등이 있을 수 있습니다. 이러한 지질 특성들은 학생이 대륙 지각과 해양 지각이 충돌하는 섭입대를 보여주는 도표를 만들 때 고려해야 할 중요한 요소입니다."}, {"score": 0.08054411, "content": "해저 해구는 어떤 생태계에서 생산자들이 메탄과 황화수소와 같은 가스에서 에너지를 확보해야 하는 곳입니다. 해저 해구는 바닷물 아래에 있는 구조물로, 지구 내부에서 나오는 가스들이 바닷물과 만나면서 생기는 특별한 환경입니다. 이러한 해저 해구에서는 생산자들이 광합성을 활용하는 대신에 메탄과 황화수소와 같은 가스들을 이용하여 에너지를 얻습니다. 이는 생태계의 다양성을 높이고, 다른 생물들에게도 영양을 공급하는 역할을 합니다. 해저 해구는 식물 네트워크에 에너지를 공급하는 독특한 생태계로서, 지구의 생태계의 한 조각입니다."}]}
{"eval_id": 69, "standalone_query": "비만도 측정 방법", "topk": ["fdb1fef4-b0ff-42c8-b326-5279ba661a90", "34bdf4ea-a524-46d4-8f85-314ad533b68a", "176c3a3a-f183-401b-811e-5381a0f63656"], "references": [{"score": 0.06963589, "content": "비만이 될 두려움은 AN 환자에서 관찰되는 현상으로, 이는 과대평가된 생각에 의해 가장 잘 설명됩니다. AN 환자들은 자신의 체중과 외모에 대해 지나치게 불안해하며, 비만이 되지 않기 위해 극단적인 다이어트와 운동을 시도합니다. 이러한 생각은 실제로는 비현실적이고 과도한 것이지만, AN 환자들은 이를 현실로 받아들이고 자신을 비판하며 두려움을 느낍니다. 이러한 비만이 될 두려움은 AN 환자의 정서적인 고통과 신체적인 건강에 부정적인 영향을 미칠 수 있습니다. 따라서, AN 환자에서 관찰되는 비만이 될 두려움은 과대평가된 생각에 의해 가장 잘 설명됩니다."}, {"score": 0.069034584, "content": "비만 확산의 주요 원인은 증가된 에너지 양/밀도와 사무적 생활 방식입니다. 현대 사회에서는 음식의 에너지 양과 밀도가 증가하였으며, 이는 비만의 주요 원인 중 하나입니다. 또한, 사무적 생활 방식도 비만의 원인으로 작용합니다. 현대인들은 컴퓨터나 스마트폰 등을 이용하여 장시간 앉아서 일하거나 공부하는 경우가 많은데, 이러한 생활 방식은 신체 활동량을 감소시키고 에너지 소비를 줄이는 결과를 가져옵니다. 따라서, 증가된 에너지 양/밀도와 사무적 생활 방식은 비만 확산의 주요 원인으로 지목될 수 있습니다."}, {"score": 0.06801584, "content": "전 세계적으로 비만의 유병률은 13%입니다. 이는 매우 높은 수치로, 건강에 대한 우려가 커지고 있습니다. 비만은 고혈압, 당뇨병, 심혈관 질환 등 다양한 건강 문제를 유발할 수 있으며, 사회적, 경제적으로도 큰 영향을 미칩니다. 따라서 비만 문제에 대한 인식과 예방이 매우 중요합니다. 정기적인 운동과 균형 잡힌 식단을 유지하는 것은 비만 예방에 큰 도움이 됩니다. 또한, 건강한 생활 습관을 가지고 비만에 대한 인식을 높이는 것이 필요합니다. 이를 통해 비만의 유병률을 줄이고 건강한 사회를 만들어 나가야 합니다."}]}
{"eval_id": 47, "standalone_query": "원자번호와 소립자의 관계", "topk": ["ffd02b96-cda9-4ef0-b232-de715a38b137", "e3671ab3-b355-45a6-be50-a15982372c6c", "cb4a3d86-988e-4425-b295-bbe34317c5cb"], "references": [{"score": 0.13038157, "content": "원자는 원소의 기본 단위로, 원자 번호는 원소를 구분하는 번호입니다. 특정 원소가 1개의 알파 입자를 방출하고, 그 후에 생성된 제품이 2개의 베타 입자를 차례로 방출한다면, 결과적으로 생성된 원소의 원자 번호는 0이 됩니다. 이는 알파 입자와 베타 입자의 방출로 인해 원자 번호가 감소하는 것을 의미합니다. 이러한 과정은 원소의 방사능 붕괴 현상 중 하나로 알려져 있습니다. 원자 번호의 변화는 원소의 화학적 성질과 특성에도 영향을 미칠 수 있습니다."}, {"score": 0.09293245, "content": "원자는 원소의 모든 특성을 가진 가장 작은 입자입니다. 원자는 화학적 반응에서 중요한 역할을 합니다. 원자는 전자, 양성자, 중성자로 구성되어 있으며, 원자핵에는 양성자와 중성자가 있고, 전자는 원자 주변에 위치해 있습니다. 원자는 원소의 특성을 결정하는데 중요한 역할을 합니다. 원자의 전자 배치와 원자 번호는 원소의 화학적 특성을 결정하는데 영향을 미칩니다. 원자는 화학 반응에서 전자를 주고받거나 공유함으로써 다른 원자와 결합할 수 있습니다. 이러한 원자의 결합은 분자의 형성을 가능하게 합니다. 원자는 화학 반응에서 에너지를 흡수하거나 방출할 수 있습니다. 이러한 에너지 변화는 화학 반응의 진행과정을 결정하는데 중요한 역할을 합니다. 따라서, 원자는 원소의 모든 특성을 가진 가장 작은 입자입니다."}, {"score": 0.09232132, "content": "원자핵에서 양성자를 뽑아내면, 원자는 원자번호가 감소하게 됩니다. 이는 원자핵에서 양성자를 뽑아내는 과정으로 인해 발생하는 현상입니다. 원자번호는 원자의 핵에 있는 양성자의 수를 나타내는데, 양성자를 뽑아내면 양성자의 수가 감소하게 되어 원자번호가 줄어들게 됩니다. 이 모든 것들은 원자핵에서 양성자를 뽑아내는 과정으로 인해 원자번호가 감소하는 것을 의미합니다. 이러한 현상은 원자핵의 안정성과 관련이 있으며, 원자핵의 구조와 성질을 이해하는 데 중요한 역할을 합니다."}]}
{"eval_id": 0, "standalone_query": "바이러스가 원핵 세포와 상호 작용하는 방법", "topk": ["e85754e3-12e4-44ec-a2c4-78a5b18b8aa7", "925dfd0e-fef9-4643-90af-0d9a32d0a662", "012207ef-dedf-42fb-a952-066e6c8867ec"], "references": [{"score": 0.19554639, "content": "바이러스는 원핵세포와 공통으로 핵산이라는 구조를 가지고 있습니다. 핵산은 바이러스의 유전 정보를 담고 있는 중요한 구성 요소입니다. 바이러스는 핵산을 이용하여 자신을 복제하고 번식하는 능력을 갖게 됩니다. 이러한 핵산은 바이러스의 생물학적 특성을 결정하는 역할을 합니다. 바이러스는 핵산을 이용하여 원핵세포와 상호 작용하며, 원핵세포 내에서 바이러스의 유전 정보를 이용하여 복제되고 번식됩니다. 따라서, 핵산은 바이러스와 원핵세포 간의 상호 작용에서 중요한 역할을 수행합니다."}, {"score": 0.13751253, "content": "인간 노로 바이러스가 세포 배양에서 배양되지 않는 경우, 지원자 연구를 통해 가장 잘 연구할 수 있습니다. 이를 위해 다양한 실험적 접근법을 사용할 수 있습니다. 첫째, 바이러스의 유전체를 분석하여 바이러스의 구조와 기능을 이해할 수 있습니다. 둘째, 바이러스의 호스트와 상호작용을 연구하여 바이러스가 세포에 어떻게 침투하고 복제되는지 알아낼 수 있습니다. 셋째, 바이러스의 복제 메커니즘을 연구하여 바이러스의 생명주기를 이해할 수 있습니다. 넷째, 바이러스의 복제를 억제하는 약물 또는 치료법을 개발하기 위해 약물 스크리닝을 수행할 수 있습니다. 이러한 다양한 연구 방법을 통해 인간 노로 바이러스에 대한 이해를 높이고, 바이러스와의 상호작용을 조절하는 방법을 찾을 수 있습니다."}, {"score": 0.1176692, "content": "일부 바이러스 균주는 체외에서 정상 포유류 세포를 암 세포로 변환할 수 있습니다. 이러한 변형은 주로 바이러스 게놈을 포유류 세포의 핵 DNA에 통합하는 것과 관련이 있습니다. 바이러스는 세포 내에 들어가면 그들의 게놈을 세포의 핵 DNA에 삽입하여 세포의 기능을 조절하고 변형시킵니다. 이러한 과정은 세포의 정상적인 성장과 분열을 방해하고 종양 형성을 유발할 수 있습니다. 따라서, 바이러스의 게놈 통합은 암 발생의 주요 원인 중 하나로 알려져 있습니다. 이러한 변환은 세포의 유전자 발현을 조절하여 암 세포의 특성을 강화하고 성장을 촉진시킵니다. 이러한 바이러스 변형은 암의 발생과 진행에 중요한 역할을 할 수 있으며, 암 치료 및 예방에 대한 연구에도 큰 영향을 미치고 있습니다."}]}
{"eval_id": 52, "standalone_query": "연기 열수공의 특성", "topk": ["70fd8635-e601-421c-9025-64fcbb2d13be", "8132c4ab-f1bd-4915-8196-a13fc3df1f05", "1e0d0ffd-1676-42a5-a2fb-e22a2de9cfbc"], "references": [{"score": 0.1464294, "content": "연기 열수공은 어떤 해양 생태계에서도 햇빛과 무관합니다. 이러한 생태계는 특이한 특성을 가지고 있습니다. 햇빛이 없는 환경에서도 연기 열수공은 살아남을 수 있으며, 다른 해양 생물들과 공존할 수 있습니다. 이러한 생태계는 깊은 해저나 어두운 동굴 등 햇빛이 도달하지 않는 곳에서 발견됩니다. 연기 열수공은 자체적으로 빛을 발산하거나 다른 에너지원을 이용하여 생존할 수 있습니다. 이러한 특이한 특성은 연구자들에게 많은 관심을 받고 있으며, 해양 생태계의 다양성을 이해하는 데에 중요한 역할을 합니다."}, {"score": 0.06490713, "content": "한 목수가 얇은 종이로 나무 조각을 덮었습니다. 그는 덮인 나무 조각을 망치로 쳤습니다. 이 과정에서 충격이 발생하였고, 종이에는 작은 구멍이 생기고 연기 냄새가 났습니다. 이 사건은 역학 에너지에서 열 에너지로 전달되는 에너지 전달 방식을 보여주었습니다. 목수가 망치로 나무 조각을 칠 때, 망치의 운동 에너지가 나무 조각에 전달되어 역학 에너지로 변환됩니다. 이 역학 에너지는 나무 조각과 종이 사이에 전달되어 종이에 충격을 주게 됩니다. 충격으로 인해 종이는 변형되고, 작은 구멍이 생기며 연기 냄새가 나타납니다. 이는 역학 에너지가 종이에 전달되어 열 에너지로 변환되는 과정입니다. 따라서, 이 사건은 역학 에너지에서 열 에너지로 전달되는 에너지 전달 방식을 보여주었을 가능성이 가장 높습니다."}, {"score": 0.059351005, "content": "담배 연기는 인간의 건강에 매우 해로운 것으로 알려져 있습니다. 담배 연기에는 다양한 유해한 물질이 포함되어 있으며, 그 중에서도 암을 유발하는 원소는 타르입니다. 타르는 담배 연기의 주요 구성 성분 중 하나로, 흡연자들이 흡입하는 공기 중에 존재합니다. 타르는 폐암, 식도암, 입암 등 다양한 종류의 암을 유발할 수 있으며, 장기간 흡연하면 암 발생 위험이 더욱 높아집니다. 따라서 담배 연기를 피하는 것이 건강에 이롭습니다. 담배를 피우는 습관을 고치고, 흡연자들에게는 금연을 권장하는 것이 중요합니다. 건강한 삶을 위해서는 담배 연기로부터 멀리 떨어져야 합니다."}]}
{"eval_id": 103, "standalone_query": "", "topk": [], "references": []}
{"eval_id": 209, "standalone_query": "bridge inverter의 역할", "topk": ["3149730b-15c0-4e4b-a8d4-0448a477238e", "7f1cc2c9-bc60-4e85-9718-8dab9789d631", "10a7b1ec-4a1f-468e-8509-c9349e6e2d9c"], "references": [{"score": 0.1357441, "content": "단상 전체 브리지 인버터는 부하 전류 모드에서 작동하기 위해서는 부하가 RLC 미급감쇠로 이루어져 있어야 합니다. RLC 미급감쇠는 저항(R), 인덕턴스(L), 커패시턴스(C)로 구성되어 있으며, 이러한 구성 요소들이 적절히 조합되어 부하를 제어합니다. 브리지 인버터는 전류를 변환하여 부하에 공급하는 역할을 수행하며, 부하가 RLC 미급감쇠로 이루어져 있을 때에만 최적의 작동을 보장할 수 있습니다. 따라서, 단상 전체 브리지 인버터를 부하 전류 모드에서 작동시키기 위해서는 부하가 RLC 미급감쇠로 이루어져 있어야 합니다."}, {"score": 0.07409039, "content": "평형 브리지에서 탐지기와 소스의 위치가 바뀌어도, 브리지는 여전히 평형을 유지한다. 이는 상반 정리라고 알려져 있습니다. 상반 정리는 물리학에서 중요한 개념으로, 두 개의 점 또는 물체가 서로에게 작용하는 힘이 같고 반대 방향을 가지면, 그들은 평형 상태에 있게 됩니다. 이는 브리지에서도 적용되는 원리입니다. 탐지기와 소스는 서로에게 작용하는 힘이 같고 반대 방향을 가지기 때문에, 브리지는 여전히 평형을 유지할 수 있습니다. 이러한 상반 정리의 원리를 이용하여 평형 브리지의 안정성을 설명할 수 있습니다."}, {"score": 0.07344135, "content": "윈 브리지 발진기는 Op-Amp를 사용하여 신호를 발진하는 회로입니다. 이 회로에서 피드백 요소는 1/2입니다. 피드백 요소는 회로의 출력 신호를 회로의 입력으로 다시 되돌려주는 역할을 합니다. 이를 통해 회로는 안정적으로 발진할 수 있습니다. 윈 브리지 발진기는 다양한 응용 분야에서 사용되며, 신호의 주파수와 진폭을 조절할 수 있습니다. 이를 통해 다양한 신호 처리 작업을 수행할 수 있습니다. Op-Amp를 사용하는 윈 브리지 발진기는 고성능과 안정성을 제공하여 다양한 전자 기기에서 사용됩니다."}]}
