{"eval_id": 78, "standalone_query": "나무의 분류 방법", "topk": ["c63b9e3a-716f-423a-9c9b-0bcaa1b9f35d", "e227a022-da3b-4810-9882-a2b27c76cc79", "c18592d1-12b6-4d45-9fcd-efbdd6d7b016"], "references": [{"score": 0.08808908, "content": "한 학생이 다양한 종류의 나무를 조사하고 있습니다. 이 학생은 성장 속도, 온도 범위, 크기가 비슷한 두 나무를 발견했습니다. 그러나 이 두 나무의 잎과 꽃은 서로 다릅니다. 이러한 특징을 고려하면, 이 나무들은 대체로 같은 속에 속해 있을 것으로 추측됩니다. 같은 속에 속한 나무들은 종류별로 유사한 특징을 가지고 있으며, 이는 생물 분류학에서 중요한 기준 중 하나입니다. 따라서 이 학생의 조사 결과는 나무의 분류와 관련된 중요한 정보를 제공할 수 있습니다. 이러한 조사는 나무의 성장과 생태에 대한 이해를 높이는 데 도움이 될 것입니다."}, {"score": 0.063400134, "content": "나무는 많은 제품들이 만들어지는 소중한 자원입니다. 나무 사용을 가장 잘 관리하는 방법은 나무를 한 그루 벨 때마다 한 그루를 심는 것입니다. 이렇게 하면 나무의 자원을 지속적으로 활용할 수 있을 뿐만 아니라, 산림을 보호하고 생태계를 유지하는 데에도 도움이 됩니다. 나무를 심는 것은 우리의 미래를 위한 투자입니다. 또한, 나무를 잘 관리하기 위해서는 적절한 수분 공급과 영양분을 제공해야 합니다. 물론, 나무를 심을 때에는 적절한 위치와 조건을 고려해야 합니다. 나무는 자연의 선물이며 우리의 삶과 환경을 더욱 풍요롭게 만들어줍니다. 따라서, 나무 사용을 가장 잘 관리하기 위해서는 나무를 심고 키우는 데에 최선을 다해야 합니다."}, {"score": 0.05769635, "content": "별은 많은 다른 방법으로 분류할 수 있습니다. 이 중에서 별을 분류하는 데 가장 유용하지 않은 것은 표면 질감입니다. 별은 종종 밤하늘에서의 겉보기 밝기로 분류됩니다. 그러나 표면 질감은 별을 분류하는 데에는 유용하지 않습니다. 표면 질감은 별의 물리적 특성과는 관련이 없으며, 별의 분류에는 다른 요소들이 더 중요합니다. 예를 들어, 별의 크기, 온도, 스펙트럼 등이 별을 분류하는 데에 더 유용한 정보를 제공합니다. 따라서 표면 질감은 별을 분류하는 데에는 가장 유용하지 않은 방법입니다."}]}
{"eval_id": 213, "standalone_query": "각 나라에서의 공교육 지출 현황", "topk": ["79c93deb-fe60-4c81-8d51-cb7400a0a156", "4f0ea39c-f16c-4d6a-9709-d106c66afcc9", "58efaaad-4d36-4dc4-953d-9f2eeaa9fda5"], "references": [{"score": 0.10375025, "content": "2017년 현재, 전세계의 공공 교육 지출은 세계 GDP의 약 4%를 차지하고 있습니다. 이는 국가들이 교육에 많은 자원을 투자하고 있다는 것을 보여줍니다. 공공 교육은 사회의 발전과 경제 성장에 중요한 역할을 합니다. 국가들은 교육을 통해 인재를 양성하고, 인구의 교육 수준을 높여 경제적인 경쟁력을 강화하고자 합니다. 따라서 많은 국가들이 교육에 많은 예산을 할당하고 있으며, 이는 세계 GDP의 4%에 해당하는 규모입니다. 이러한 투자는 국가의 교육 체계를 강화하고, 국민들의 교육 기회를 확대하는 데 도움을 줍니다. 공공 교육 지출은 국가의 교육 정책과 우선순위를 반영하며, 국가의 교육 수준과 경제 성장에 직결되는 중요한 지표입니다."}, {"score": 0.06854918, "content": "세계 의료비 총지출은 2017년 현재 세계 GDP의 약 10%를 차지하고 있습니다. 이는 세계 각국이 건강과 의료에 많은 자원을 투자하고 있다는 것을 보여줍니다. 의료비 총지출은 의료 시스템의 발전과 인구의 건강 수준 향상을 위해 중요한 지표로 사용됩니다. 세계 의료비 총지출이 GDP의 10%에 이르는 것은 의료 분야에 대한 긍정적인 투자와 의료 기술의 발전을 반영하는 결과입니다. 이러한 투자는 인류의 건강과 복지를 증진시키는 데 큰 역할을 합니다."}, {"score": 0.060707353, "content": "전기력은 전하 사이에 작용하는 힘입니다. 이 문제에서는 두 개의 전기를 띠는 공이 짧은 거리로 분리되어 있고, 그 사이에 50μN의 힘이 발생한다고 주어졌습니다. 각 공의 전하는 동일하게 유지되면서, 한 공의 질량만 두 배로 증가시킵니다.\n\n전기력은 전하의 크기와 거리에 비례하며, 전하의 크기와 질량은 독립적인 개념입니다. 따라서 한 공의 질량이 두 배로 증가하더라도, 다른 공의 전하는 변하지 않습니다.\n\n따라서, 공 사이의 새로운 전기 힘은 여전히 50μN입니다."}]}
{"eval_id": 107, "standalone_query": "기억 상실증 원인", "topk": ["25de4ffd-cee4-4f27-907e-fd6b802c6ede", "0c2d5267-638a-4954-8974-55d28a3fe600", "8d7709e5-4325-4c93-ad33-0fc7006dc0a9"], "references": [{"score": 0.09332645, "content": "기억 상실은 대뇌의 기능 장애로 인해 발생할 가능성이 가장 높습니다. 대뇌는 인간의 중추신경계에서 가장 중요한 역할을 담당하며, 인지, 기억, 감정 등 다양한 기능을 조절합니다. 따라서 대뇌의 어느 부분에서 문제가 발생하면 기억 상실이나 기타 인지 기능의 장애가 발생할 수 있습니다. 대뇌는 뇌의 가장 큰 부분으로, 뇌의 표면에 위치한 뇌피질과 그 아래에 있는 심층뇌로 구성되어 있습니다. 이러한 대뇌의 구조와 기능이 원활하게 작동하지 않으면 기억 상실이 발생할 수 있습니다. 따라서 대뇌는 기억 상실과 관련된 가장 중요한 부분으로 간주됩니다."}, {"score": 0.086084016, "content": "고령화와 함께 작업 기억력이 떨어지는 이유는 자원의 손실과 처리 속도의 저하입니다. 고령화는 인간의 신체적인 기능의 저하를 의미하며, 이는 작업 기억력에도 영향을 미칩니다. 고령화로 인해 뇌의 자원이 감소하고, 이로 인해 작업 기억력이 떨어지는 것입니다. 또한, 고령화로 인해 뇌의 처리 속도도 저하됩니다. 뇌의 신경 세포들이 느려지고, 신호 전달이 더 오래 걸리기 때문에 작업 기억력이 저하되는 것입니다. 따라서, 고령화와 함께 작업 기억력이 떨어지는 이유는 자원의 손실과 처리 속도의 저하입니다."}, {"score": 0.08444521, "content": "노인들이 젊은 성인들보다 우울증이 적은 이유는 상실에 대처하는 방법을 배웠기 때문입니다. 노인들은 오랜 인생 경험을 통해 다양한 상실을 겪어왔습니다. 가족이나 친구의 사망, 건강의 악화, 사회적 지위의 하락 등 다양한 상황에서 상실감을 느꼈을 것입니다. 그러나 노인들은 이러한 상실에 대처하는 방법을 배웠습니다. 그들은 시간이 지나면서 상실에 대한 이해와 수용력을 키웠으며, 자신의 감정을 표현하고 공유하는 방법을 익혔습니다. 이러한 자기 표현과 공유는 우울증을 예방하고 치유하는 데 도움이 됩니다. 노인들은 또한 긍정적인 마인드셋을 유지하고, 삶의 변화에 적응하는 능력을 갖추었습니다. 이러한 자세는 우울증을 예방하는 데 중요한 역할을 합니다. 따라서 노인들은 젊은 성인들보다 우울증이 적은 것으로 나타납니다."}]}
{"eval_id": 81, "standalone_query": "통학 버스의 가치", "topk": ["bd91bda8-351e-4683-bb1a-8254f93e2376", "5d48fa4e-1999-45dc-b768-b15b30a87cc5", "684e0657-f3e1-4e4c-a7c2-7b24c69e7ff8"], "references": [{"score": 0.07443382, "content": "학교 버스는 동일한 거리에 놓여 있을 때, 가장 큰 인력을 가질 것이다. 이는 학교 버스 간에 존재할 것이다. 학교 버스는 많은 학생들을 운송하고, 학교로 가는 길에 많은 사람들을 만난다. 따라서, 학교 버스는 많은 사람들의 관심과 주목을 받을 것이다. 또한, 학교 버스는 학교의 상징이기도 하며, 학생들에게 안전하고 편리한 이동 수단을 제공한다. 따라서, 학교 버스는 동일한 거리에 놓여 있을 때, 가장 큰 인력을 가지고 있을 것이다."}, {"score": 0.066844895, "content": "한 대의 버스가 두 도시 간 280 킬로미터를 이동했습니다. 이 버스는 첫 번째 도시를 오후 3시에 출발하여 두 번째 도시에 오후 7시에 도착했습니다. 따라서, 이 버스의 이동에 걸린 시간은 4시간입니다. 이를 토대로 버스의 평균 속도를 계산해보면, 280 킬로미터를 4시간 동안 이동했으므로, 평균 속도는 70 km/h입니다. 따라서, 이 버스의 평균 속도는 70 km/h입니다."}, {"score": 0.05959341, "content": "8086/8088 프로세서에서는 버스 사이클의 길이가 네 개의 클록 사이클로 구성됩니다. 이 네 개의 클록 사이클은 T1, T2, T3, T4로 구성되어 있습니다. 또한, 대기 상태 클록 사이클인 Tw도 존재합니다. 이 대기 상태는 항상 T3와 T4 사이에 삽입됩니다. 이렇게 구성된 버스 사이클은 프로세서의 동작을 조정하고 데이터의 전송을 관리하는 역할을 합니다. 프로세서의 성능과 안정성을 유지하기 위해 이러한 버스 사이클의 구성은 중요한 역할을 합니다."}]}
{"eval_id": 280, "standalone_query": "Dmitri Ivanovsky", "topk": ["38686456-b993-4cbb-af0d-1c53df2f3e12", "e532908f-6658-4128-9076-a00c590b98ec", "513cac7a-3b86-45f6-8d4c-30b86338b637"], "references": [{"score": 0.124387465, "content": "드미트리 이바노프스키는 식물학자로 알려진 사람으로, 그는 최초의 바이러스를 발견한 사람입니다. 그는 바이러스의 존재를 밝혀내고 그 특성을 연구하여 많은 사람들에게 큰 영향을 주었습니다. 이바노프스키의 발견은 과학계에 큰 파장을 일으켰으며, 바이러스에 대한 연구와 이해를 더욱 발전시키는 계기가 되었습니다. 이바노프스키의 발견은 현대 의학과 생물학의 발전에 큰 영향을 미쳤으며, 그의 업적은 오늘날에도 많은 사람들에게 기억되고 있습니다."}, {"score": 0.010009546, "content": "도미닉은 현미경으로 볼복스 군집과 짚신벌레를 관찰하고 있다. 볼복스 군집과 짚신벌레는 이동을 위한 다수의 세포 소기관을 가지고 있다는 사실을 도미닉은 일지에 기록했다. 이러한 관찰 결과로부터 도미닉은 볼복스 군집과 짚신벌레가 이동을 위해 에너지원을 향해 이동한다는 가능성을 알아냈다. 이동은 생물의 기본적인 활동 중 하나로, 에너지를 얻기 위해 필요한 행동이다. 따라서, 도미닉이 볼복스 군집과 짚신벌레의 이동에 대해 알아낼 가능성이 가장 높은 것은 둘 다 에너지원을 향해 이동한다는 것이다."}, {"score": 0.009106028, "content": "하디-바인베르크 평형을 보이는 보통염색체열성질환이 6400분의 1의 발생률을 가지고 있다면, 보인자의 빈도는 대략 40분의 1이다. 이는 매우 낮은 빈도로 발생하는 유전적인 현상이다. 하디-바인베르크 평형은 유전학에서 중요한 개념으로, 염색체의 분리와 재조합에 관련된 현상을 설명한다. 보통염색체열성질환이란, 염색체의 특정 부위에 변이가 발생하여 염색체의 열성을 유발하는 질환이다. 이러한 질환이 발생하는 빈도는 매우 낮기 때문에, 보인자의 빈도는 40분의 1로 추정된다. 이러한 유전적인 현상은 인간의 유전체 연구와 질병의 원인 파악에 중요한 역할을 한다."}]}
{"eval_id": 10, "standalone_query": "피임을 위한 약물 치료의 효과와 부작용", "topk": ["99a07643-8479-4d34-9de8-68627854f458", "3370df4d-35fe-4b71-8cb0-5b29dd536da3", "e5fdf1a0-337d-4032-abaa-19a6bcdbf304"], "references": [{"score": 0.18864429, "content": "피임약 도입에 관한 실험적 연구는 빈곤한 푸에르토리코 여성들을 대상으로 이루어졌다. 이 연구는 피임약의 효과와 부작용을 조사하기 위해 진행되었다. 실험은 여러 단계로 이루어져서, 푸에르토리코 여성들에게 피임약을 제공하고 그 결과를 분석하였다. 연구 결과는 피임약이 효과적으로 임신을 예방하는 데 도움이 되었으며, 부작용은 일부 사용자들에게 나타났다. 이러한 연구는 피임약의 개발과 사용에 대한 중요한 정보를 제공하였고, 이후에 다른 지역과 여성들에게도 적용되었다. 피임약은 현재 많은 여성들에게 선택적인 피임 방법으로 사용되고 있다."}, {"score": 0.14266378, "content": "약은 사람들이 아플 때 치료하는 데 사용됩니다. 그러나 일부 약은 먹는 사람들에게 나쁜 반응을 일으킬 수 있습니다. 이러한 차이는 한 문제의 해결책이 다른 문제를 일으키는 것입니다. 예를 들어, 통증을 완화하기 위해 진통제를 복용하는 경우가 있습니다. 그러나 이러한 약물은 일부 사람들에게는 위장 장애를 유발할 수 있습니다. 이는 약물의 부작용으로 인한 것입니다. 따라서 약물을 사용할 때는 이러한 부작용을 고려해야 합니다. 또 다른 예로는 항생제가 있습니다. 항생제는 감염을 치료하기 위해 사용되지만, 일부 사람들은 항생제에 알레르기 반응을 보일 수 있습니다. 이는 약물에 대한 개인의 반응에 따른 것입니다. 따라서 약물을 처방받을 때는 개인의 알레르기 반응을 고려해야 합니다. 이처럼 약물의 사용은 사람들을 치료하는 데 도움이 되지만, 일부 사람들에게는 부작용을 일으킬 수 있습니다. 이러한 차이는 한 문제의 해결책이 다른 문제를 일으키는 것입니다."}, {"score": 0.115104206, "content": "유럽에서 비만 치료를 위해 승인된 약물은 오를리스타트입니다. 오를리스타트는 비만 환자들에게 체중 감량을 도와주는 약물로, 유럽 의약품청(EMA)에 의해 승인되었습니다. 이 약물은 식욕 억제 효과를 가지고 있어 식사량을 줄이고 체중 감량을 도모할 수 있습니다. 오를리스타트는 비만 치료를 위한 다른 치료법이 실패한 환자들에게 권장되며, 의사의 처방에 따라 사용되어야 합니다. 이 약물은 체중 감량을 도모하기 위해 식이요법과 운동과 함께 사용되어야 하며, 부작용이 있을 수 있으므로 의사와의 상담이 필요합니다. 오를리스타트는 비만 치료를 위한 중요한 옵션 중 하나이며, 유럽에서 많은 환자들에게 효과적으로 사용되고 있습니다."}]}
{"eval_id": 100, "standalone_query": "헬륨이 다른 원소들과 반응을 잘 안하는 이유", "topk": ["d9ce8432-f72e-4253-9735-98318a6f9f7f", "dca2aa92-6361-49bf-b726-63c28aeb1eb6", "2799c61e-5d2c-4c3f-b4a4-d58ffdee9f92"], "references": [{"score": 0.116485395, "content": "희귀한 기체인 헬륨, 네온, 아르곤, 크립톤, 크세논, 라돈은 다른 원소들과 거의 반응하지 않습니다. 이는 최외각 에너지 준위가 완전하게 채워져 있기 때문입니다. 이러한 특성으로 인해 이러한 희귀 기체들은 안정하고 비활성인 성질을 가지고 있습니다. 이들은 화학 반응에서 거의 관여하지 않으며, 다른 원소들과 결합하여 화합물을 형성하지 않습니다. 이러한 특징은 희귀 기체들을 다양한 산업 분야에서 사용할 수 있게 만들어줍니다. 예를 들어, 헬륨은 기체 냉매로 사용되며, 네온은 광고 표시판에 사용됩니다. 아르곤은 용접 작업에 사용되고, 크세논은 높은 휘도를 가진 조명 장치에 사용됩니다. 이러한 희귀 기체들은 우리 일상 생활에서도 다양한 용도로 활용되고 있습니다."}, {"score": 0.1012906, "content": "비활성기체가 포함된 등전자는 대표 원소의 1원자 이온으로 종종 나타납니다. 이 등전자는 전자 구성이 완전한 상태이기 때문에 화학적으로 매우 안정하며, 반응성이 낮습니다. 이러한 특성으로 인해 비활성기체인 헬륨, 네온, 아르곤 등이 종종 대표 원소의 1원자 이온으로 존재합니다. 이 등전자는 전자의 외관 전하를 나타내며, 대표 원소의 화학적 특성을 결정하는 중요한 역할을 합니다. 따라서, 대표 원소의 1원자 이온은 비활성기체가 포함된 등전자로서 매우 중요한 역할을 수행합니다."}, {"score": 0.10127488, "content": "주기율표는 원소들을 그룹과 주기로 나누어 표현하는 방법입니다. 그룹은 세로로 배열된 열을 의미하며, 가장 반응성이 낮은 원소를 포함하는 그룹은 그룹 18 (8A)입니다. 이 그룹은 흔히 비활성 기체라고도 불리며, 헬륨, 네온, 아르곤 등을 포함하고 있습니다. 이러한 원소들은 전자 껍질이 완전히 채워져 있어 다른 원소와의 화학적 반응이 거의 일어나지 않습니다. 따라서, 그룹 18은 가장 반응성이 낮은 원소들을 포함하고 있습니다."}]}
{"eval_id": 279, "standalone_query": "문맹 비율이 사회 발전에 미치는 영향", "topk": ["de1ab247-9d48-48f7-8499-31606f53c108", "0f0dd1ae-a36c-4c97-9785-4698400c67b1", "19e3b967-5815-4ec3-b2e2-e70d2aa87bfe"], "references": [{"score": 0.14327958, "content": "1950년에 전세계 인구 중 문맹이 아닌 사람은 대략 56%였습니다. 이는 인류의 문맹률이 점차 감소하고 있음을 보여줍니다. 세계 각국에서 교육의 중요성이 인식되고, 교육 기회가 늘어나면서 문맹률이 낮아지고 있습니다. 이러한 추세는 사회의 발전과 인간의 인권 증진에 긍정적인 영향을 미치고 있습니다. 문맹률이 낮아짐으로써 사람들은 더 많은 정보를 얻을 수 있고, 경제적으로도 더 발전할 수 있습니다. 따라서, 국가 및 국제 단위에서 교육의 중요성을 강조하고, 모든 사람들에게 교육 기회를 제공하는 것이 필요합니다. 이를 통해 문맹률을 더욱 낮출 수 있고, 더욱 발전된 사회를 구축할 수 있을 것입니다."}, {"score": 0.120819464, "content": "현재로서 2015년 기준으로, 전 세계에서 15세 이상의 인구 중 문맹이 아닌 사람은 86%입니다. 이는 매우 높은 비율입니다. 세계적으로 문맹률이 감소하고, 교육의 중요성이 인식되고 있는 것을 알 수 있습니다. 문맹이 아닌 사람들은 글을 읽고 쓰는 능력을 갖추고 있으며, 정보에 더욱 쉽게 접근할 수 있습니다. 이는 사회의 발전과 개인의 성장에 매우 중요한 역할을 합니다. 그러나 여전히 문맹인 사람들이 존재하므로, 국가 및 국제 단체들은 더 많은 노력을 기울여 문맹률을 더욱 낮추는 데에 주력해야 합니다. 교육의 기회를 더욱 확대하고, 문맹인 사람들에게도 교육의 기회를 제공함으로써 더욱 공정하고 평등한 사회를 구축할 수 있을 것입니다."}, {"score": 0.07715327, "content": "수력 발전소를 이용한 에너지 생산은 세계의 기후 변화에 영향을 미칠 가능성이 가장 작은 것입니다. 수력 발전소는 자연적인 자원인 물을 이용하여 전기를 생산하는 방식으로, 화석 연료를 사용하지 않기 때문에 온실가스 배출량이 매우 적습니다. 또한, 수력 발전소는 지속 가능한 에너지 생산 방법으로 알려져 있으며, 기후 변화에 대한 대응책으로 많이 활용되고 있습니다. 따라서, 수력 발전소를 이용한 에너지 생산은 환경에 미치는 영향이 가장 적으며, 기후 변화에 영향을 미칠 가능성이 가장 작은 것으로 알려져 있습니다."}]}
{"eval_id": 42, "standalone_query": "이란-콘트라 사건 미국 정치 영향", "topk": ["4b49f3a2-32c9-4b2e-89c4-4719f98e7a74", "e181b15e-d1a2-445e-8867-2bc0b6a0ae65", "47653c41-e2c2-4c64-b7ee-c4c8e90741cb"], "references": [{"score": 0.26418447, "content": "1987년에 이란-콘트라 사건이 발생했습니다. 이 사건은 이란과 니카라과의 갈등과 미국의 개입으로 인해 발생한 것으로 알려져 있습니다. 이 사건에서 미국인들 중 75%는 레이건 대통령이 정보를 숨기고 있다고 믿었습니다. 이는 레이건 대통령의 신뢰도가 낮아진 원인 중 하나였습니다. 이란-콘트라 사건은 미국 역사상 중요한 사건 중 하나로 기억되고 있으며, 이 사건은 미국의 외교 정책과 국내 정치에 큰 영향을 미쳤습니다."}, {"score": 0.09201285, "content": "미국에서는 2013년 현재, 정당이 부패했다는 의식을 가진 사람들의 비율이 76%입니다. 이는 많은 사람들이 정치적인 부패와 불공정한 시스템에 대한 우려를 가지고 있다는 것을 보여줍니다. 정당의 부패는 공공의 이익을 훼손하고 시민들의 불신을 증폭시킬 수 있으며, 이는 민주주의의 원칙과 가치에 위협이 될 수 있습니다. 이러한 문제에 대한 인식과 대응은 미국 정치의 발전과 민주주의의 강화를 위해 중요한 과제입니다. 정당의 부패를 막기 위해서는 투명하고 효과적인 정치적인 체계와 강력한 법률 시행이 필요합니다. 또한, 시민들은 정치에 관심을 가지고 참여하며, 부패와 불공정에 대한 신호를 주고 반발해야 합니다. 이를 통해 미국은 더욱 공정하고 투명한 정치적인 환경을 구축할 수 있을 것입니다."}, {"score": 0.08883209, "content": "미국인들 중에서 1965년에 베트남 파병이 실수였다고 생각하는 사람은 약 25%입니다. 이는 조사 결과에 따른 것으로, 대다수의 미국인들은 이 결정에 대해 다양한 의견을 가지고 있습니다. 그러나 일부 사람들은 이 파병이 전략적인 실수였다고 믿고 있습니다. 이들은 파병으로 인해 미국이 베트남 전쟁에서 큰 피해를 입었고, 불필요한 인명 피해를 초래했다고 주장합니다. 반면에 다른 사람들은 이 결정이 당시의 정치적, 군사적 상황을 고려한 합리적인 선택이었다고 주장합니다. 이들은 베트남 파병이 미국의 국익을 위해 이루어진 것이며, 동남아시아 지역의 안정을 위한 필요한 조치였다고 믿습니다. 이러한 의견의 차이는 역사적인 사건에 대한 해석의 다양성을 보여줍니다. 따라서 1965년에 베트남 파병이 실수였는지에 대한 의견은 여전히 분분하며, 논란의 여지가 있습니다."}]}
{"eval_id": 308, "standalone_query": "자기장이 강한 정도는 어떻게 표현되나요?", "topk": ["72c780ec-57bb-4fe1-976a-d7ee3d3dbb52", "f89b9b74-3a21-477d-a728-48d36844bcb5", "e02fda33-0517-4c73-9da9-6a7492897813"], "references": [{"score": 0.13599472, "content": "자속의 단위는 웨버입니다. 웨버는 자기장의 크기를 나타내는 단위로 사용됩니다. 자속은 자기장이 특정한 공간에서 얼마나 강하게 작용하는지를 나타내는데, 웨버는 이러한 자속의 크기를 측정하는 데 사용됩니다. 웨버는 국제단위계에서 정의된 단위로, 자기장의 세기와 면적의 곱으로 표현됩니다. 자속은 자기장의 세기에 비례하므로, 웨버가 클수록 자속이 강하다는 것을 의미합니다. 따라서, 자속을 측정하고자 할 때는 웨버를 사용하여 자기장의 크기를 정확하게 표현할 수 있습니다."}, {"score": 0.10589425, "content": "지구형 행성이 강한 자기장을 가지기 위한 필요 조건은 녹아있는 금속 핵과 적당히 빠른 회전이 모두 필요합니다. 자기장은 행성의 핵에서 생성되며, 이를 유지하기 위해서는 핵이 녹아있어야 합니다. 녹아있는 금속 핵은 자기장을 생성하는데 필요한 전류를 생성할 수 있습니다. 또한, 행성의 회전 속도도 자기장의 강도에 영향을 줍니다. 적당히 빠른 회전은 자기장을 강화시키는데 도움을 줄 수 있습니다. 따라서, 지구형 행성이 강한 자기장을 가지기 위해서는 녹아있는 금속 핵과 적당히 빠른 회전이 모두 필요합니다."}, {"score": 0.09415906, "content": "화성은 강한 자기장을 잃었을 때 기후가 변했다고 여겨집니다. 강한 자기장이 없으면 태양풍이 대부분의 대기를 제거하여 온실 효과를 크게 줄이고 화성을 식혔을 것입니다. 이로 인해 화성의 기후는 현재와는 매우 다른 모습을 보일 것입니다. 강한 자기장이 있었을 때는 온실 효과가 크게 작용하여 화성의 기온이 상승하고 수증기가 증발하여 대기 중에 많은 양의 이산화탄소가 존재했을 것입니다. 그러나 강한 자기장을 잃은 후에는 태양풍이 대기를 제거하여 온실 효과를 줄였고, 이로 인해 화성은 식게 되었습니다. 따라서, 강한 자기장의 손실은 화성의 기후 변화에 큰 영향을 미쳤을 것으로 여겨집니다."}]}
